A1: Feeder type | B1: RG213
A2: Matched loss | B2: 1.7999999999999999E-2 | C2: dB/m
A3: at | B3: 10 | C3: MHz
A4: Frequency | C4: 1.8 | D4: 3.5 | E4: 7 | F4: 10 | G4: 14 | H4: 21 | I4: 29 | J4: MHz
A5: Length | B5: 2.5 | J5: metres
A6: Matched loss | C6: =$B5*$B$2*(C$4/$B$3)^0.54 -> 1.7826236604145739E-2 | D6: =$B5*$B$2*(D$4/$B$3)^0.54 -> 2.5527557184050299E-2 | E6: =$B5*$B$2*(E$4/$B$3)^0.54 -> 3.7116366579931795E-2 | F6: =$B5*$B$2*(F$4/$B$3)^0.54 -> 4.4999999999999998E-2 | G6: =$B5*$B$2*(G$4/$B$3)^0.54 -> 5.3966176950006883E-2 | H6: =$B5*$B$2*(H$4/$B$3)^0.54 -> 6.7175503909955095E-2 | I6: =$B5*$B$2*(I$4/$B$3)^0.54 -> 7.9966379312459354E-2 | J6: dB
A7: a = 10^(ML/10) | C7: =10^(C6/10) -> 1.0041130782503367 | D7: =10^(D6/10) -> 1.0058952462335522 | E7: =10^(E6/10) -> 1.0085829836281408 | F7: =10^(F6/10) -> 1.0104155005282134 | G7: =10^(G6/10) -> 1.0125036971085211 | H7: =10^(H6/10) -> 1.0155879759190121 | I7: =10^(I6/10) -> 1.0185835027109544
A8: SWR | B8: |rho|
A9: 1 | B9: =(A9-1)/(A9+1) -> 0.000 | C9: =10*LOG10((C$7^2 - $B9^2)/(C$7*(1-$B9^2)))-C$6 -> -4.5449755070592346E-16 | D9: =10*LOG10((D$7^2 - $B9^2)/(D$7*(1-$B9^2)))-D$6 -> -1.214306433183765E-16 | E9: =10*LOG10((E$7^2 - $B9^2)/(E$7*(1-$B9^2)))-E$6 -> -3.3306690738754696E-16 | F9: =10*LOG10((F$7^2 - $B9^2)/(F$7*(1-$B9^2)))-F$6 -> 5.5511151231257827E-17 | G9: =10*LOG10((G$7^2 - $B9^2)/(G$7*(1-$B9^2)))-G$6 -> 3.6082248300317588E-16 | H9: =10*LOG10((H$7^2 - $B9^2)/(H$7*(1-$B9^2)))-H$6 -> 0.000 | I9: =10*LOG10((I$7^2 - $B9^2)/(I$7*(1-$B9^2)))-I$6 -> 0.000
A10: 1.5 | B10: =(A10-1)/(A10+1) -> 00.2 | C10: =10*LOG10((C$7^2 - $B10^2)/(C$7*(1-$B10^2)))-C$6 -> 1.4791869099486481E-3 | D10: =10*LOG10((D$7^2 - $B10^2)/(D$7*(1-$B10^2)))-D$6 -> 2.1143264176925192E-3 | E10: =10*LOG10((E$7^2 - $B10^2)/(E$7*(1-$B10^2)))-E$6 -> 3.0656640937324758E-3 | F10: =10*LOG10((F$7^2 - $B10^2)/(F$7*(1-$B10^2)))-F$6 -> 3.7098259471573455E-3 | G10: =10*LOG10((G$7^2 - $B10^2)/(G$7*(1-$B10^2)))-G$6 -> 4.4394888792833528E-3 | H10: =10*LOG10((H$7^2 - $B10^2)/(H$7*(1-$B10^2)))-H$6 -> 5.5087617099772168E-3 | I10: =10*LOG10((I$7^2 - $B10^2)/(I$7*(1-$B10^2)))-I$6 -> 6.5377327128151447E-3
A11: 2 | B11: =(A11-1)/(A11+1) -> 0.33333333333333331 | C11: =10*LOG10((C$7^2 - $B11^2)/(C$7*(1-$B11^2)))-C$6 -> 4.4360501746231219E-3 | D11: =10*LOG10((D$7^2 - $B11^2)/(D$7*(1-$B11^2)))-D$6 -> 6.3398937299756312E-3 | E11: =10*LOG10((E$7^2 - $B11^2)/(E$7*(1-$B11^2)))-E$6 -> 9.1905077960455842E-3 | F11: =10*LOG10((F$7^2 - $B11^2)/(F$7*(1-$B11^2)))-F$6 -> 1.1119984343887231E-2 | G11: =10*LOG10((G$7^2 - $B11^2)/(G$7*(1-$B11^2)))-G$6 -> 1.3304875252020204E-2 | H11: =10*LOG10((H$7^2 - $B11^2)/(H$7*(1-$B11^2)))-H$6 -> 1.6505366753610307E-2 | I11: =10*LOG10((I$7^2 - $B11^2)/(I$7*(1-$B11^2)))-I$6 -> 1.958374691726851E-2
A12: 5 | B12: =(A12-1)/(A12+1) -> 0.66666666666666663 | C12: =10*LOG10((C$7^2 - $B12^2)/(C$7*(1-$B12^2)))-C$6 -> 2.8312735982878996E-2 | D12: =10*LOG10((D$7^2 - $B12^2)/(D$7*(1-$B12^2)))-D$6 -> 4.0416304702140957E-2 | E12: =10*LOG10((E$7^2 - $B12^2)/(E$7*(1-$B12^2)))-E$6 -> 5.8485944689078057E-2 | F12: =10*LOG10((F$7^2 - $B12^2)/(F$7*(1-$B12^2)))-F$6 -> 7.0680796483823277E-2 | G12: =10*LOG10((G$7^2 - $B12^2)/(G$7*(1-$B12^2)))-G$6 -> 8.4455237867551186E-2 | H12: =10*LOG10((H$7^2 - $B12^2)/(H$7*(1-$B12^2)))-H$6 -> 0.10456633241261067 | I12: =10*LOG10((I$7^2 - $B12^2)/(I$7*(1-$B12^2)))-I$6 -> 0.12383653104138918
A13: 10 | B13: =(A13-1)/(A13+1) -> 0.81818181818181823 | C13: =10*LOG10((C$7^2 - $B13^2)/(C$7*(1-$B13^2)))-C$6 -> 7.131203092275977E-2 | D13: =10*LOG10((D$7^2 - $B13^2)/(D$7*(1-$B13^2)))-D$6 -> 0.1015839112000478 | E13: =10*LOG10((E$7^2 - $B13^2)/(E$7*(1-$B13^2)))-E$6 -> 0.1465434305651066 | F13: =10*LOG10((F$7^2 - $B13^2)/(F$7*(1-$B13^2)))-F$6 -> 0.17672942793151097 | G13: =10*LOG10((G$7^2 - $B13^2)/(G$7*(1-$B13^2)))-G$6 -> 0.21067590009726173 | H13: =10*LOG10((H$7^2 - $B13^2)/(H$7*(1-$B13^2)))-H$6 -> 0.25995788545960341 | I13: =10*LOG10((I$7^2 - $B13^2)/(I$7*(1-$B13^2)))-I$6 -> 0.30687141997420136
A14: 20 | B14: =(A14-1)/(A14+1) -> 0.90476190476190477 | C14: =10*LOG10((C$7^2 - $B14^2)/(C$7*(1-$B14^2)))-C$6 -> 0.15733842604692844 | D14: =10*LOG10((D$7^2 - $B14^2)/(D$7*(1-$B14^2)))-D$6 -> 0.22320211806751189 | E14: =10*LOG10((E$7^2 - $B14^2)/(E$7*(1-$B14^2)))-E$6 -> 0.32004127210908995 | F14: =10*LOG10((F$7^2 - $B14^2)/(F$7*(1-$B14^2)))-F$6 -> 0.38441894107839175 | G14: =10*LOG10((G$7^2 - $B14^2)/(G$7*(1-$B14^2)))-G$6 -> 0.45621843649082799 | H14: =10*LOG10((H$7^2 - $B14^2)/(H$7*(1-$B14^2)))-H$6 -> 0.55935802001399115 | I14: =10*LOG10((I$7^2 - $B14^2)/(I$7*(1-$B14^2)))-I$6 -> 0.65637289822598555
A15: 50 | B15: =(A15-1)/(A15+1) -> 0.96078431372549022 | C15: =10*LOG10((C$7^2 - $B15^2)/(C$7*(1-$B15^2)))-C$6 -> 0.4066129116804415 | D15: =10*LOG10((D$7^2 - $B15^2)/(D$7*(1-$B15^2)))-D$6 -> 0.57020253888416783 | E15: =10*LOG10((E$7^2 - $B15^2)/(E$7*(1-$B15^2)))-E$6 -> 0.80429616745688903 | F15: =10*LOG10((F$7^2 - $B15^2)/(F$7*(1-$B15^2)))-F$6 -> 0.95595666454390515 | G15: =10*LOG10((G$7^2 - $B15^2)/(G$7*(1-$B15^2)))-G$6 -> 1.1216093680479815 | H15: =10*LOG10((H$7^2 - $B15^2)/(H$7*(1-$B15^2)))-H$6 -> 1.3535359254403179 | I15: =10*LOG10((I$7^2 - $B15^2)/(I$7*(1-$B15^2)))-I$6 -> 1.5656532985859584
A16: 100 | B16: =(A16-1)/(A16+1) -> 0.98019801980198018 | C16: =10*LOG10((C$7^2 - $B16^2)/(C$7*(1-$B16^2)))-C$6 -> 0.79298716895017751 | D16: =10*LOG10((D$7^2 - $B16^2)/(D$7*(1-$B16^2)))-D$6 -> 1.0936313503861175 | E16: =10*LOG10((E$7^2 - $B16^2)/(E$7*(1-$B16^2)))-E$6 -> 1.5083479101223314 | F16: =10*LOG10((F$7^2 - $B16^2)/(F$7*(1-$B16^2)))-F$6 -> 1.7682795949893415 | G16: =10*LOG10((G$7^2 - $B16^2)/(G$7*(1-$B16^2)))-G$6 -> 2.0451066653506413 | H16: =10*LOG10((H$7^2 - $B16^2)/(H$7*(1-$B16^2)))-H$6 -> 2.4214165046421958 | I16: =10*LOG10((I$7^2 - $B16^2)/(I$7*(1-$B16^2)))-I$6 -> 2.7552181500620416
A21: Length | B21: 5 | J21: metres
A22: Matched loss | C22: =$B21*$B$2*(C$4/$B$3)^0.54 -> 3.5652473208291478E-2 | D22: =$B21*$B$2*(D$4/$B$3)^0.54 -> 5.1055114368100597E-2 | E22: =$B21*$B$2*(E$4/$B$3)^0.54 -> 7.423273315986359E-2 | F22: =$B21*$B$2*(F$4/$B$3)^0.54 -> 00.09 | G22: =$B21*$B$2*(G$4/$B$3)^0.54 -> 0.10793235390001377 | H22: =$B21*$B$2*(H$4/$B$3)^0.54 -> 0.13435100781991019 | I22: =$B21*$B$2*(I$4/$B$3)^0.54 -> 0.15993275862491871 | J22: dB
A23: a = 10^(ML/10) | C23: =10^(C22/10) -> 1.008243073913367 | D23: =10^(D22/10) -> 1.0118252463952586 | E23: =10^(E22/10) -> 1.0172396348642427 | F23: =10^(F22/10) -> 1.02093948370768 | G23: =10^(G22/10) -> 1.0251637366584236 | H23: =10^(H22/10) -> 1.0314189368312758 | I23: =10^(I22/10) -> 1.037512351994917
A24: SWR | B24: |rho|
A25: 1 | B25: =(A25-1)/(A25+1) -> 0.000 | C25: =10*LOG10((C$23^2 - $B25^2)/(C$23*(1-$B25^2)))-C$22 -> 0.000 | D25: =10*LOG10((D$23^2 - $B25^2)/(D$23*(1-$B25^2)))-D$22 -> -2.1510571102112408E-16 | E25: =10*LOG10((E$23^2 - $B25^2)/(E$23*(1-$B25^2)))-E$22 -> 1.3877787807814457E-16 | F25: =10*LOG10((F$23^2 - $B25^2)/(F$23*(1-$B25^2)))-F$22 -> 0.000 | G25: =10*LOG10((G$23^2 - $B25^2)/(G$23*(1-$B25^2)))-G$22 -> 2.2204460492503131E-16 | H25: =10*LOG10((H$23^2 - $B25^2)/(H$23*(1-$B25^2)))-H$22 -> 0.000 | I25: =10*LOG10((I$23^2 - $B25^2)/(I$23*(1-$B25^2)))-I$22 -> 3.0531133177191805E-16
A26: 1.5 | B26: =(A26-1)/(A26+1) -> 00.2 | C26: =10*LOG10((C$23^2 - $B26^2)/(C$23*(1-$B26^2)))-C$22 -> 2.9457829852023096E-3 | D26: =10*LOG10((D$23^2 - $B26^2)/(D$23*(1-$B26^2)))-D$22 -> 4.2029317298280106E-3 | E26: =10*LOG10((E$23^2 - $B26^2)/(E$23*(1-$B26^2)))-E$22 -> 6.0772650822380481E-3 | F26: =10*LOG10((F$23^2 - $B26^2)/(F$23*(1-$B26^2)))-F$22 -> 7.3404937202287968E-3 | G26: =10*LOG10((G$23^2 - $B26^2)/(G$23*(1-$B26^2)))-G$22 -> 8.7656377090166993E-3 | H26: =10*LOG10((H$23^2 - $B26^2)/(H$23*(1-$B26^2)))-H$22 -> 1.0843053092442767E-2 | I26: =10*LOG10((I$23^2 - $B26^2)/(I$23*(1-$B26^2)))-I$22 -> 1.2829786099600171E-2
A27: 2 | B27: =(A27-1)/(A27+1) -> 0.33333333333333331 | C27: =10*LOG10((C$23^2 - $B27^2)/(C$23*(1-$B27^2)))-C$22 -> 8.8313614240325758E-3 | D27: =10*LOG10((D$23^2 - $B27^2)/(D$23*(1-$B27^2)))-D$22 -> 1.2596612538170411E-2 | E27: =10*LOG10((E$23^2 - $B27^2)/(E$23*(1-$B27^2)))-E$22 -> 1.8206342077534257E-2 | F27: =10*LOG10((F$23^2 - $B27^2)/(F$23*(1-$B27^2)))-F$22 -> 2.1984364733218131E-2 | G27: =10*LOG10((G$23^2 - $B27^2)/(G$23*(1-$B27^2)))-G$22 -> 2.6244014301904539E-2 | H27: =10*LOG10((H$23^2 - $B27^2)/(H$23*(1-$B27^2)))-H$22 -> 3.2448279954410103E-2 | I27: =10*LOG10((I$23^2 - $B27^2)/(I$23*(1-$B27^2)))-I$22 -> 3.8376211082997547E-2
A28: 5 | B28: =(A28-1)/(A28+1) -> 0.66666666666666663 | C28: =10*LOG10((C$23^2 - $B28^2)/(C$23*(1-$B28^2)))-C$22 -> 5.6212849584909748E-2 | D28: =10*LOG10((D$23^2 - $B28^2)/(D$23*(1-$B28^2)))-D$22 -> 7.9994086669090247E-2 | E28: =10*LOG10((E$23^2 - $B28^2)/(E$23*(1-$B28^2)))-E$22 -> 0.11522306325219361 | F28: =10*LOG10((F$23^2 - $B28^2)/(F$23*(1-$B28^2)))-F$22 -> 0.13881435254176386 | G28: =10*LOG10((G$23^2 - $B28^2)/(G$23*(1-$B28^2)))-G$22 -> 0.16528470095045689 | H28: =10*LOG10((H$23^2 - $B28^2)/(H$23*(1-$B28^2)))-H$22 -> 0.20359887110936278 | I28: =10*LOG10((I$23^2 - $B28^2)/(I$23*(1-$B28^2)))-I$22 -> 0.23994397977592327
A29: 10 | B29: =(A29-1)/(A29+1) -> 0.81818181818181823 | C29: =10*LOG10((C$23^2 - $B29^2)/(C$23*(1-$B29^2)))-C$22 -> 0.14090296124030105 | D29: =10*LOG10((D$23^2 - $B29^2)/(D$23*(1-$B29^2)))-D$22 -> 0.19969885077878372 | E29: =10*LOG10((E$23^2 - $B29^2)/(E$23*(1-$B29^2)))-E$22 -> 0.28593872245267715 | F29: =10*LOG10((F$23^2 - $B29^2)/(F$23*(1-$B29^2)))-F$22 -> 0.34313035967921968 | G29: =10*LOG10((G$23^2 - $B29^2)/(G$23*(1-$B29^2)))-G$22 -> 0.40678072228129147 | H29: =10*LOG10((H$23^2 - $B29^2)/(H$23*(1-$B29^2)))-H$22 -> 0.49795976966430255 | I29: =10*LOG10((I$23^2 - $B29^2)/(I$23*(1-$B29^2)))-I$22 -> 0.58344326263438662
A30: 20 | B30: =(A30-1)/(A30+1) -> 0.90476190476190477 | C30: =10*LOG10((C$23^2 - $B30^2)/(C$23*(1-$B30^2)))-C$22 -> 0.30795534952821707 | D30: =10*LOG10((D$23^2 - $B30^2)/(D$23*(1-$B30^2)))-D$22 -> 0.43306946250511774 | E30: =10*LOG10((E$23^2 - $B30^2)/(E$23*(1-$B30^2)))-E$22 -> 0.61322330396464941 | F30: =10*LOG10((F$23^2 - $B30^2)/(F$23*(1-$B30^2)))-F$22 -> 0.73059867875976547 | G30: =10*LOG10((G$23^2 - $B30^2)/(G$23*(1-$B30^2)))-G$22 -> 0.85935802687134444 | H30: =10*LOG10((H$23^2 - $B30^2)/(H$23*(1-$B30^2)))-H$22 -> 1.0405362646871197 | I30: =10*LOG10((I$23^2 - $B30^2)/(I$23*(1-$B30^2)))-I$22 -> 1.2070859762368806
A31: 50 | B31: =(A31-1)/(A31+1) -> 0.96078431372549022 | C31: =10*LOG10((C$23^2 - $B31^2)/(C$23*(1-$B31^2)))-C$22 -> 0.77548007293978516 | D31: =10*LOG10((D$23^2 - $B31^2)/(D$23*(1-$B31^2)))-D$22 -> 1.0685906886874403 | E31: =10*LOG10((E$23^2 - $B31^2)/(E$23*(1-$B31^2)))-E$22 -> 1.4720023751369398 | F31: =10*LOG10((F$23^2 - $B31^2)/(F$23*(1-$B31^2)))-F$22 -> 1.7242643947662486 | G31: =10*LOG10((G$23^2 - $B31^2)/(G$23*(1-$B31^2)))-G$22 -> 1.9923884907943012 | H31: =10*LOG10((H$23^2 - $B31^2)/(H$23*(1-$B31^2)))-H$22 -> 2.3559143152671704 | I31: =10*LOG10((I$23^2 - $B31^2)/(I$23*(1-$B31^2)))-I$22 -> 2.6773786313244115
A32: 100 | B32: =(A32-1)/(A32+1) -> 0.98019801980198018 | C32: =10*LOG10((C$23^2 - $B32^2)/(C$23*(1-$B32^2)))-C$22 -> 1.458212737079859 | D32: =10*LOG10((D$23^2 - $B32^2)/(D$23*(1-$B32^2)))-D$22 -> 1.9572724999548865 | E32: =10*LOG10((E$23^2 - $B32^2)/(E$23*(1-$B32^2)))-E$22 -> 2.6089935654189409 | F32: =10*LOG10((F$23^2 - $B32^2)/(F$23*(1-$B32^2)))-F$22 -> 2.9989631727122252 | G32: =10*LOG10((G$23^2 - $B32^2)/(G$23*(1-$B32^2)))-G$22 -> 3.4007053531905487 | H32: =10*LOG10((H$23^2 - $B32^2)/(H$23*(1-$B32^2)))-H$22 -> 3.9270519201600753 | I32: =10*LOG10((I$23^2 - $B32^2)/(I$23*(1-$B32^2)))-I$22 -> 4.3771826747582274
A37: Length | B37: 10 | J37: metres
A38: Matched loss | C38: =$B37*$B$2*(C$4/$B$3)^0.54 -> 7.1304946416582957E-2 | D38: =$B37*$B$2*(D$4/$B$3)^0.54 -> 0.10211022873620119 | E38: =$B37*$B$2*(E$4/$B$3)^0.54 -> 0.14846546631972718 | F38: =$B37*$B$2*(F$4/$B$3)^0.54 -> 00.18 | G38: =$B37*$B$2*(G$4/$B$3)^0.54 -> 0.21586470780002753 | H38: =$B37*$B$2*(H$4/$B$3)^0.54 -> 0.26870201563982038 | I38: =$B37*$B$2*(I$4/$B$3)^0.54 -> 0.31986551724983742 | J38: dB
A39: a = 10^(ML/10) | C39: =10^(C38/10) -> 1.0165540960942752 | D39: =10^(D38/10) -> 1.0237903292428259 | E39: =10^(E38/10) -> 1.0347764747387378 | F39: =10^(F38/10) -> 1.0423174293933042 | G39: =10^(G38/10) -> 1.0509606869594617 | H39: =10^(H38/10) -> 1.0638250232541593 | I39: =10^(I38/10) -> 1.0764318805420243
A40: SWR | B40: |rho|
A41: 1 | B41: =(A41-1)/(A41+1) -> 0.000 | C41: =10*LOG10((C$39^2 - $B41^2)/(C$39*(1-$B41^2)))-C$38 -> -1.2490009027033011E-16 | D41: =10*LOG10((D$39^2 - $B41^2)/(D$39*(1-$B41^2)))-D$38 -> -1.5265566588595902E-16 | E41: =10*LOG10((E$39^2 - $B41^2)/(E$39*(1-$B41^2)))-E$38 -> 0.000 | F41: =10*LOG10((F$39^2 - $B41^2)/(F$39*(1-$B41^2)))-F$38 -> 3.3306690738754696E-16 | G41: =10*LOG10((G$39^2 - $B41^2)/(G$39*(1-$B41^2)))-G$38 -> 0.000 | H41: =10*LOG10((H$39^2 - $B41^2)/(H$39*(1-$B41^2)))-H$38 -> 0.000 | I41: =10*LOG10((I$39^2 - $B41^2)/(I$39*(1-$B41^2)))-I$38 -> 0.000
A42: 1.5 | B42: =(A42-1)/(A42+1) -> 00.2 | C42: =10*LOG10((C$39^2 - $B42^2)/(C$39*(1-$B42^2)))-C$38 -> 5.8416470561961503E-3 | D42: =10*LOG10((D$39^2 - $B42^2)/(D$39*(1-$B42^2)))-D$38 -> 8.3042748097320873E-3 | E42: =10*LOG10((E$39^2 - $B42^2)/(E$39*(1-$B42^2)))-E$38 -> 1.1942217931738164E-2 | F42: =10*LOG10((F$39^2 - $B42^2)/(F$39*(1-$B42^2)))-F$38 -> 1.4371325538211355E-2 | G42: =10*LOG10((G$39^2 - $B42^2)/(G$39*(1-$B42^2)))-G$38 -> 1.7089838768827637E-2 | H42: =10*LOG10((H$39^2 - $B42^2)/(H$39*(1-$B42^2)))-H$38 -> 2.1010943325299514E-2 | I42: =10*LOG10((I$39^2 - $B42^2)/(I$39*(1-$B42^2)))-I$38 -> 2.4714730379321537E-2
A43: 2 | B43: =(A43-1)/(A43+1) -> 0.33333333333333331 | C43: =10*LOG10((C$39^2 - $B43^2)/(C$39*(1-$B43^2)))-C$38 -> 1.7501421278257948E-2 | D43: =10*LOG10((D$39^2 - $B43^2)/(D$39*(1-$B43^2)))-D$38 -> 2.4865339148891538E-2 | E43: =10*LOG10((E$39^2 - $B43^2)/(E$39*(1-$B43^2)))-E$38 -> 3.5728586973498372E-2 | F43: =10*LOG10((F$39^2 - $B43^2)/(F$39*(1-$B43^2)))-F$38 -> 4.2972089356638876E-2 | G43: =10*LOG10((G$39^2 - $B43^2)/(G$39*(1-$B43^2)))-G$38 -> 5.1069080227815644E-2 | H43: =10*LOG10((H$39^2 - $B43^2)/(H$39*(1-$B43^2)))-H$38 -> 6.2730317475808761E-2 | I43: =10*LOG10((I$39^2 - $B43^2)/(I$39*(1-$B43^2)))-I$38 -> 7.3726213343394964E-2
A44: 5 | B44: =(A44-1)/(A44+1) -> 0.66666666666666663 | C44: =10*LOG10((C$39^2 - $B44^2)/(C$39*(1-$B44^2)))-C$38 -> 0.11080935067589322 | D44: =10*LOG10((D$39^2 - $B44^2)/(D$39*(1-$B44^2)))-D$38 -> 0.15673213404682734 | E44: =10*LOG10((E$39^2 - $B44^2)/(E$39*(1-$B44^2)))-E$38 -> 0.22374241445081861 | F44: =10*LOG10((F$39^2 - $B44^2)/(F$39*(1-$B44^2)))-F$38 -> 0.26794801238687677 | G44: =10*LOG10((G$39^2 - $B44^2)/(G$39*(1-$B44^2)))-G$38 -> 0.31692138060521702 | H44: =10*LOG10((H$39^2 - $B44^2)/(H$39*(1-$B44^2)))-H$38 -> 0.38665325011867907 | I44: =10*LOG10((I$39^2 - $B44^2)/(I$39*(1-$B44^2)))-I$38 -> 0.45156429724713992
A45: 10 | B45: =(A45-1)/(A45+1) -> 0.81818181818181823 | C45: =10*LOG10((C$39^2 - $B45^2)/(C$39*(1-$B45^2)))-C$38 -> 0.27518932267130403 | D45: =10*LOG10((D$39^2 - $B45^2)/(D$39*(1-$B45^2)))-D$38 -> 0.38627480255065166 | E45: =10*LOG10((E$39^2 - $B45^2)/(E$39*(1-$B45^2)))-E$38 -> 0.54545668161064342 | F45: =10*LOG10((F$39^2 - $B45^2)/(F$39*(1-$B45^2)))-F$38 -> 0.64865741489931139 | G45: =10*LOG10((G$39^2 - $B45^2)/(G$39*(1-$B45^2)))-G$38 -> 0.76138404421028139 | H45: =10*LOG10((H$39^2 - $B45^2)/(H$39*(1-$B45^2)))-H$38 -> 0.9191092897349562 | I45: =10*LOG10((I$39^2 - $B45^2)/(I$39*(1-$B45^2)))-I$38 -> 1.0631338368270284
A46: 20 | B46: =(A46-1)/(A46+1) -> 0.90476190476190477 | C46: =10*LOG10((C$39^2 - $B46^2)/(C$39*(1-$B46^2)))-C$38 -> 0.59097882003527058 | D46: =10*LOG10((D$39^2 - $B46^2)/(D$39*(1-$B46^2)))-D$38 -> 0.81808647868059436 | E46: =10*LOG10((E$39^2 - $B46^2)/(E$39*(1-$B46^2)))-E$38 -> 1.1334591092452801 | F46: =10*LOG10((F$39^2 - $B46^2)/(F$39*(1-$B46^2)))-F$38 -> 1.3321028738614917 | G46: =10*LOG10((G$39^2 - $B46^2)/(G$39*(1-$B46^2)))-G$38 -> 1.544266685631541 | H46: =10*LOG10((H$39^2 - $B46^2)/(H$39*(1-$B46^2)))-H$38 -> 1.8333228899364822 | I46: =10*LOG10((I$39^2 - $B46^2)/(I$39*(1-$B46^2)))-I$38 -> 2.0899680189462795
A47: 50 | B47: =(A47-1)/(A47+1) -> 0.96078431372549022 | C47: =10*LOG10((C$39^2 - $B47^2)/(C$39*(1-$B47^2)))-C$38 -> 1.423293196066387 | D47: =10*LOG10((D$39^2 - $B47^2)/(D$39*(1-$B47^2)))-D$38 -> 1.9073776465525785 | E47: =10*LOG10((E$39^2 - $B47^2)/(E$39*(1-$B47^2)))-E$38 -> 2.536679365017986 | F47: =10*LOG10((F$39^2 - $B47^2)/(F$39*(1-$B47^2)))-F$38 -> 2.9114740397701602 | G47: =10*LOG10((G$39^2 - $B47^2)/(G$39*(1-$B47^2)))-G$38 -> 3.2960311033539167 | H47: =10*LOG10((H$39^2 - $B47^2)/(H$39*(1-$B47^2)))-H$38 -> 3.797200293130822 | I47: =10*LOG10((I$39^2 - $B47^2)/(I$39*(1-$B47^2)))-I$38 -> 4.2231087270167329
A48: 100 | B48: =(A48-1)/(A48+1) -> 0.98019801980198018 | C48: =10*LOG10((C$39^2 - $B48^2)/(C$39*(1-$B48^2)))-C$38 -> 2.5322292637495201 | D48: =10*LOG10((D$39^2 - $B48^2)/(D$39*(1-$B48^2)))-D$38 -> 3.27465780509735 | E48: =10*LOG10((E$39^2 - $B48^2)/(E$39*(1-$B48^2)))-E$38 -> 4.1818045325607471 | F48: =10*LOG10((F$39^2 - $B48^2)/(F$39*(1-$B48^2)))-F$38 -> 4.6970192329897085 | G48: =10*LOG10((G$39^2 - $B48^2)/(G$39*(1-$B48^2)))-G$38 -> 5.2095786726851738 | H48: =10*LOG10((H$39^2 - $B48^2)/(H$39*(1-$B48^2)))-H$38 -> 5.8567467586169295 | I48: =10*LOG10((I$39^2 - $B48^2)/(I$39*(1-$B48^2)))-I$38 -> 6.3909370760356641
A54: Length | B54: 30 | J54: metres
A55: Matched loss | C55: =$B54*$B$2*(C$4/$B$3)^0.54 -> 0.21391483924974883 | D55: =$B54*$B$2*(D$4/$B$3)^0.54 -> 0.30633068620860354 | E55: =$B54*$B$2*(E$4/$B$3)^0.54 -> 0.44539639895918154 | F55: =$B54*$B$2*(F$4/$B$3)^0.54 -> 00.54 | G55: =$B54*$B$2*(G$4/$B$3)^0.54 -> 0.64759412340008249 | H55: =$B54*$B$2*(H$4/$B$3)^0.54 -> 0.80610604691946097 | I55: =$B54*$B$2*(I$4/$B$3)^0.54 -> 0.95959655174951208 | J55: dB
A56: a = 10^(ML/10) | C56: =10^(C55/10) -> 1.0504889390283205 | D56: =10^(D55/10) -> 1.0730823918698895 | E56: =10^(E55/10) -> 1.1079996925816444 | F56: =10^(F55/10) -> 1.132400363235557 | G56: =10^(G55/10) -> 1.1608053802012734 | H56: =10^(H55/10) -> 1.2039559703014873 | I56: =10^(I55/10) -> 1.2472676409489738
A57: SWR | B57: Rho
A58: 1 | B58: =(A58-1)/(A58+1) -> 0.000 | C58: =10*LOG10((C$56^2 - $B58^2)/(C$56*(1-$B58^2)))-C$55 -> 0.000 | D58: =10*LOG10((D$56^2 - $B58^2)/(D$56*(1-$B58^2)))-D$55 -> 0.000 | E58: =10*LOG10((E$56^2 - $B58^2)/(E$56*(1-$B58^2)))-E$55 -> 0.000 | F58: =10*LOG10((F$56^2 - $B58^2)/(F$56*(1-$B58^2)))-F$55 -> 0.000 | G58: =10*LOG10((G$56^2 - $B58^2)/(G$56*(1-$B58^2)))-G$55 -> 0.000 | H58: =10*LOG10((H$56^2 - $B58^2)/(H$56*(1-$B58^2)))-H$55 -> 0.000 | I58: =10*LOG10((I$56^2 - $B58^2)/(I$56*(1-$B58^2)))-I$55 -> 0.000
A59: 1.5 | B59: =(A59-1)/(A59+1) -> 00.2 | C59: =10*LOG10((C$56^2 - $B59^2)/(C$56*(1-$B59^2)))-C$55 -> 1.6943235216196034E-2 | D59: =10*LOG10((D$56^2 - $B59^2)/(D$56*(1-$B59^2)))-D$55 -> 2.3743706852306312E-2 | E59: =10*LOG10((E$56^2 - $B59^2)/(E$56*(1-$B59^2)))-E$55 -> 3.3428305684034931E-2 | F59: =10*LOG10((F$56^2 - $B59^2)/(F$56*(1-$B59^2)))-F$55 -> 3.9659434126658843E-2 | G59: =10*LOG10((G$56^2 - $B59^2)/(G$56*(1-$B59^2)))-G$55 -> 4.641386264792513E-2 | H59: =10*LOG10((H$56^2 - $B59^2)/(H$56*(1-$B59^2)))-H$55 -> 5.5757123208050707E-2 | I59: =10*LOG10((I$56^2 - $B59^2)/(I$56*(1-$B59^2)))-I$55 -> 6.41599322981109E-2
A60: 2 | B60: =(A60-1)/(A60+1) -> 0.33333333333333331 | C60: =10*LOG10((C$56^2 - $B60^2)/(C$56*(1-$B60^2)))-C$55 -> 5.0632682666726686E-2 | D60: =10*LOG10((D$56^2 - $B60^2)/(D$56*(1-$B60^2)))-D$55 -> 7.0845199457619801E-2 | E60: =10*LOG10((E$56^2 - $B60^2)/(E$56*(1-$B60^2)))-E$55 -> 9.9522772409480764E-2 | F60: =10*LOG10((F$56^2 - $B60^2)/(F$56*(1-$B60^2)))-F$55 -> 0.11790806375337515 | G60: =10*LOG10((G$56^2 - $B60^2)/(G$56*(1-$B60^2)))-G$55 -> 0.13777947985398131 | H60: =10*LOG10((H$56^2 - $B60^2)/(H$56*(1-$B60^2)))-H$55 -> 0.16516873474707372 | I60: =10*LOG10((I$56^2 - $B60^2)/(I$56*(1-$B60^2)))-I$55 -> 0.18970437744895829
A61: 5 | B61: =(A61-1)/(A61+1) -> 0.66666666666666663 | C61: =10*LOG10((C$56^2 - $B61^2)/(C$56*(1-$B61^2)))-C$55 -> 0.31429361501931508 | D61: =10*LOG10((D$56^2 - $B61^2)/(D$56*(1-$B61^2)))-D$55 -> 0.43463481511107654 | E61: =10*LOG10((E$56^2 - $B61^2)/(E$56*(1-$B61^2)))-E$55 -> 0.60076370031946502 | F61: =10*LOG10((F$56^2 - $B61^2)/(F$56*(1-$B61^2)))-F$55 -> 0.70457510719082006 | G61: =10*LOG10((G$56^2 - $B61^2)/(G$56*(1-$B61^2)))-G$55 -> 0.81453303339072514 | H61: =10*LOG10((H$56^2 - $B61^2)/(H$56*(1-$B61^2)))-H$55 -> 0.96245676001348524 | I61: =10*LOG10((I$56^2 - $B61^2)/(I$56*(1-$B61^2)))-I$55 -> 1.0915798233363208
A62: 10 | B62: =(A62-1)/(A62+1) -> 0.81818181818181823 | C62: =10*LOG10((C$56^2 - $B62^2)/(C$56*(1-$B62^2)))-C$55 -> 0.75537722834179688 | D62: =10*LOG10((D$56^2 - $B62^2)/(D$56*(1-$B62^2)))-D$55 -> 1.0258225877918978 | E62: =10*LOG10((E$56^2 - $B62^2)/(E$56*(1-$B62^2)))-E$55 -> 1.3846847588578635 | F62: =10*LOG10((F$56^2 - $B62^2)/(F$56*(1-$B62^2)))-F$55 -> 1.6012144495130123 | G62: =10*LOG10((G$56^2 - $B62^2)/(G$56*(1-$B62^2)))-G$55 -> 1.8246676500279051 | H62: =10*LOG10((H$56^2 - $B62^2)/(H$56*(1-$B62^2)))-H$55 -> 2.11648040109886 | I62: =10*LOG10((I$56^2 - $B62^2)/(I$56*(1-$B62^2)))-I$55 -> 2.3636480647791807
A63: 20 | B63: =(A63-1)/(A63+1) -> 0.90476190476190477 | C63: =10*LOG10((C$56^2 - $B63^2)/(C$56*(1-$B63^2)))-C$55 -> 1.5330824314364213 | D63: =10*LOG10((D$56^2 - $B63^2)/(D$56*(1-$B63^2)))-D$55 -> 2.0241154383421289 | E63: =10*LOG10((E$56^2 - $B63^2)/(E$56*(1-$B63^2)))-E$55 -> 2.6406611947299812 | F63: =10*LOG10((F$56^2 - $B63^2)/(F$56*(1-$B63^2)))-F$55 -> 2.9961986210250666 | G63: =10*LOG10((G$56^2 - $B63^2)/(G$56*(1-$B63^2)))-G$55 -> 3.3518283781060534 | H63: =10*LOG10((H$56^2 - $B63^2)/(H$56*(1-$B63^2)))-H$55 -> 3.8009884767241013 | I63: =10*LOG10((I$56^2 - $B63^2)/(I$56*(1-$B63^2)))-I$55 -> 4.1694537101836735
A64: 50 | B64: =(A64-1)/(A64+1) -> 0.96078431372549022 | C64: =10*LOG10((C$56^2 - $B64^2)/(C$56*(1-$B64^2)))-C$55 -> 3.2761330327371416 | D64: =10*LOG10((D$56^2 - $B64^2)/(D$56*(1-$B64^2)))-D$55 -> 4.115390301259791 | E64: =10*LOG10((E$56^2 - $B64^2)/(E$56*(1-$B64^2)))-E$55 -> 5.0869940772386544 | F64: =10*LOG10((F$56^2 - $B64^2)/(F$56*(1-$B64^2)))-F$55 -> 5.6147580395719592 | G64: =10*LOG10((G$56^2 - $B64^2)/(G$56*(1-$B64^2)))-G$55 -> 6.1232866742970105 | H64: =10*LOG10((H$56^2 - $B64^2)/(H$56*(1-$B64^2)))-H$55 -> 6.7420789960216601 | I64: =10*LOG10((I$56^2 - $B64^2)/(I$56*(1-$B64^2)))-I$55 -> 7.2329968609206796
A65: 100 | B65: =(A65-1)/(A65+1) -> 0.98019801980198018 | C65: =10*LOG10((C$56^2 - $B65^2)/(C$56*(1-$B65^2)))-C$55 -> 5.1834199097346758 | D65: =10*LOG10((D$56^2 - $B65^2)/(D$56*(1-$B65^2)))-D$55 -> 6.2570753244678388 | E65: =10*LOG10((E$56^2 - $B65^2)/(E$56*(1-$B65^2)))-E$55 -> 7.4381163038760372 | F65: =10*LOG10((F$56^2 - $B65^2)/(F$56*(1-$B65^2)))-F$55 -> 8.0582103853071452 | G65: =10*LOG10((G$56^2 - $B65^2)/(G$56*(1-$B65^2)))-G$55 -> 8.6441673392990541 | H65: =10*LOG10((H$56^2 - $B65^2)/(H$56*(1-$B65^2)))-H$55 -> 9.3442327664922225 | I65: =10*LOG10((I$56^2 - $B65^2)/(I$56*(1-$B65^2)))-I$55 -> 9.8909895378770951