A1: Feeder type | B1: RG58
A2: Matched loss | B2: 4.4999999999999998E-2 | C2: dB/m
A3: at | B3: 10 | C3: MHz
A4: Frequency | C4: 1.8 | D4: 3.5 | E4: 7 | F4: 10 | G4: 14 | H4: 21 | I4: 29 | J4: MHz
A5: Length | B5: 2.5 | J5: metres
A6: Matched loss | C6: =$B5*$B$2*(C$4/$B$3)^0.54 -> 4.4565591510364343E-2 | D6: =$B5*$B$2*(D$4/$B$3)^0.54 -> 6.3818892960125745E-2 | E6: =$B5*$B$2*(E$4/$B$3)^0.54 -> 9.2790916449829494E-2 | F6: =$B5*$B$2*(F$4/$B$3)^0.54 -> 0.1125 | G6: =$B5*$B$2*(G$4/$B$3)^0.54 -> 0.13491544237501718 | H6: =$B5*$B$2*(H$4/$B$3)^0.54 -> 0.1679387597748877 | I6: =$B5*$B$2*(I$4/$B$3)^0.54 -> 0.19991594828114836 | J6: dB
A7: a = 10^(ML/10) | C7: =10^(C6/10) -> 1.0103144375080519 | D7: =10^(D6/10) -> 1.0148033431779981 | E7: =10^(E6/10) -> 1.0215957832137943 | F7: =10^(F6/10) -> 1.0262425089274543 | G7: =10^(G6/10) -> 1.0315529947909443 | H7: =10^(H6/10) -> 1.0394267180030961 | I7: =10^(I6/10) -> 1.0471082825153446
A8: SWR | B8: |rho|
A9: 1 | B9: =(A9-1)/(A9+1) -> 0.000 | C9: =10*LOG10((C$7^2 - $B9^2)/(C$7*(1-$B9^2)))-C$6 -> 1.457167719820518E-16 | D9: =10*LOG10((D$7^2 - $B9^2)/(D$7*(1-$B9^2)))-D$6 -> 0.000 | E9: =10*LOG10((E$7^2 - $B9^2)/(E$7*(1-$B9^2)))-E$6 -> 0.000 | F9: =10*LOG10((F$7^2 - $B9^2)/(F$7*(1-$B9^2)))-F$6 -> 0.000 | G9: =10*LOG10((G$7^2 - $B9^2)/(G$7*(1-$B9^2)))-G$6 -> 0.000 | H9: =10*LOG10((H$7^2 - $B9^2)/(H$7*(1-$B9^2)))-H$6 -> 3.3306690738754696E-16 | I9: =10*LOG10((I$7^2 - $B9^2)/(I$7*(1-$B9^2)))-I$6 -> 0.000
A10: 1.5 | B10: =(A10-1)/(A10+1) -> 00.2 | C10: =10*LOG10((C$7^2 - $B10^2)/(C$7*(1-$B10^2)))-C$6 -> 3.6743943043925156E-3 | D10: =10*LOG10((D$7^2 - $B10^2)/(D$7*(1-$B10^2)))-D$6 -> 5.2376907200446243E-3 | E10: =10*LOG10((E$7^2 - $B10^2)/(E$7*(1-$B10^2)))-E$6 -> 7.5631020175326719E-3 | F10: =10*LOG10((F$7^2 - $B10^2)/(F$7*(1-$B10^2)))-F$6 -> 9.1266927637895789E-3 | G10: =10*LOG10((G$7^2 - $B10^2)/(G$7*(1-$B10^2)))-G$6 -> 1.0887151122959932E-2 | H10: =10*LOG10((H$7^2 - $B10^2)/(H$7*(1-$B10^2)))-H$6 -> 1.3446570921715167E-2 | I10: =10*LOG10((I$7^2 - $B10^2)/(I$7*(1-$B10^2)))-I$6 -> 1.5886688849225922E-2
A11: 2 | B11: =(A11-1)/(A11+1) -> 0.33333333333333331 | C11: =10*LOG10((C$7^2 - $B11^2)/(C$7*(1-$B11^2)))-C$6 -> 1.1013869763369301E-2 | D11: =10*LOG10((D$7^2 - $B11^2)/(D$7*(1-$B11^2)))-D$6 -> 1.5694159842036454E-2 | E11: =10*LOG10((E$7^2 - $B11^2)/(E$7*(1-$B11^2)))-E$6 -> 2.2649907654007026E-2 | F11: =10*LOG10((F$7^2 - $B11^2)/(F$7*(1-$B11^2)))-F$6 -> 2.7322739843880006E-2 | G11: =10*LOG10((G$7^2 - $B11^2)/(G$7*(1-$B11^2)))-G$6 -> 3.2579916218651084E-2 | H11: =10*LOG10((H$7^2 - $B11^2)/(H$7*(1-$B11^2)))-H$6 -> 4.0215454305822212E-2 | I11: =10*LOG10((I$7^2 - $B11^2)/(I$7*(1-$B11^2)))-I$6 -> 4.748677964632389E-2
A12: 5 | B12: =(A12-1)/(A12+1) -> 0.66666666666666663 | C12: =10*LOG10((C$7^2 - $B12^2)/(C$7*(1-$B12^2)))-C$6 -> 7.0010870003552161E-2 | D12: =10*LOG10((D$7^2 - $B12^2)/(D$7*(1-$B12^2)))-D$6 -> 9.9476313030684133E-2 | E12: =10*LOG10((E$7^2 - $B12^2)/(E$7*(1-$B12^2)))-E$6 -> 0.14295910947563778 | F12: =10*LOG10((F$7^2 - $B12^2)/(F$7*(1-$B12^2)))-F$6 -> 0.17196670388102103 | G12: =10*LOG10((G$7^2 - $B12^2)/(G$7*(1-$B12^2)))-G$6 -> 0.2044087247747931 | H12: =10*LOG10((H$7^2 - $B12^2)/(H$7*(1-$B12^2)))-H$6 -> 0.25116915030929771 | I12: =10*LOG10((I$7^2 - $B12^2)/(I$7*(1-$B12^2)))-I$6 -> 0.29531123345688548
A13: 10 | B13: =(A13-1)/(A13+1) -> 0.81818181818181823 | C13: =10*LOG10((C$7^2 - $B13^2)/(C$7*(1-$B13^2)))-C$6 -> 0.1750743952462944 | D13: =10*LOG10((D$7^2 - $B13^2)/(D$7*(1-$B13^2)))-D$6 -> 0.24751609777195296 | E13: =10*LOG10((E$7^2 - $B13^2)/(E$7*(1-$B13^2)))-E$6 -> 0.35313288222185368 | F13: =10*LOG10((F$7^2 - $B13^2)/(F$7*(1-$B13^2)))-F$6 -> 0.42276256697040787 | G13: =10*LOG10((G$7^2 - $B13^2)/(G$7*(1-$B13^2)))-G$6 -> 0.49987512883184171 | H13: =10*LOG10((H$7^2 - $B13^2)/(H$7*(1-$B13^2)))-H$6 -> 0.60965093174287499 | I13: =10*LOG10((I$7^2 - $B13^2)/(I$7*(1-$B13^2)))-I$6 -> 0.71184575560413155
A14: 20 | B14: =(A14-1)/(A14+1) -> 0.90476190476190477 | C14: =10*LOG10((C$7^2 - $B14^2)/(C$7*(1-$B14^2)))-C$6 -> 0.38090234181971983 | D14: =10*LOG10((D$7^2 - $B14^2)/(D$7*(1-$B14^2)))-D$6 -> 0.53343961363661951 | E14: =10*LOG10((E$7^2 - $B14^2)/(E$7*(1-$B14^2)))-E$6 -> 0.75096143585857933 | F14: =10*LOG10((F$7^2 - $B14^2)/(F$7*(1-$B14^2)))-F$6 -> 0.89138812071663587 | G14: =10*LOG10((G$7^2 - $B14^2)/(G$7*(1-$B14^2)))-G$6 -> 1.0443023678762904 | H14: =10*LOG10((H$7^2 - $B14^2)/(H$7*(1-$B14^2)))-H$6 -> 1.2575338099496114 | I14: =10*LOG10((I$7^2 - $B14^2)/(I$7*(1-$B14^2)))-I$6 -> 1.4516276381532047
A15: 50 | B15: =(A15-1)/(A15+1) -> 0.96078431372549022 | C15: =10*LOG10((C$7^2 - $B15^2)/(C$7*(1-$B15^2)))-C$6 -> 0.94775034373722999 | D15: =10*LOG10((D$7^2 - $B15^2)/(D$7*(1-$B15^2)))-D$6 -> 1.2958965910074833 | E15: =10*LOG10((E$7^2 - $B15^2)/(E$7*(1-$B15^2)))-E$6 -> 1.7672460010365278 | F15: =10*LOG10((F$7^2 - $B15^2)/(F$7*(1-$B15^2)))-F$6 -> 2.0577811304519757 | G15: =10*LOG10((G$7^2 - $B15^2)/(G$7*(1-$B15^2)))-G$6 -> 2.363312373118041 | H15: =10*LOG10((H$7^2 - $B15^2)/(H$7*(1-$B15^2)))-H$6 -> 2.7725520518061089 | I15: =10*LOG10((I$7^2 - $B15^2)/(I$7*(1-$B15^2)))-I$6 -> 3.12999044266471
A16: 100 | B16: =(A16-1)/(A16+1) -> 0.98019801980198018 | C16: =10*LOG10((C$7^2 - $B16^2)/(C$7*(1-$B16^2)))-C$6 -> 1.754378498780182 | D16: =10*LOG10((D$7^2 - $B16^2)/(D$7*(1-$B16^2)))-D$6 -> 2.3290508632009961 | E16: =10*LOG10((E$7^2 - $B16^2)/(E$7*(1-$B16^2)))-E$6 -> 3.0642079162996305 | F16: =10*LOG10((F$7^2 - $B16^2)/(F$7*(1-$B16^2)))-F$6 -> 3.4968670666100943 | G16: =10*LOG10((G$7^2 - $B16^2)/(G$7*(1-$B16^2)))-G$6 -> 3.9375641883475856 | H16: =10*LOG10((H$7^2 - $B16^2)/(H$7*(1-$B16^2)))-H$6 -> 4.5079787319149158 | I16: =10*LOG10((I$7^2 - $B16^2)/(I$7*(1-$B16^2)))-I$6 -> 4.9901167213478912
A21: Length | B21: 5 | J21: metres
A22: Matched loss | C22: =$B21*$B$2*(C$4/$B$3)^0.54 -> 8.9131183020728685E-2 | D22: =$B21*$B$2*(D$4/$B$3)^0.54 -> 0.12763778592025149 | E22: =$B21*$B$2*(E$4/$B$3)^0.54 -> 0.18558183289965899 | F22: =$B21*$B$2*(F$4/$B$3)^0.54 -> 0.22500000000000001 | G22: =$B21*$B$2*(G$4/$B$3)^0.54 -> 0.26983088475003436 | H22: =$B21*$B$2*(H$4/$B$3)^0.54 -> 0.33587751954977541 | I22: =$B21*$B$2*(I$4/$B$3)^0.54 -> 0.39983189656229673 | J22: dB
A23: a = 10^(ML/10) | C23: =10^(C22/10) -> 1.0207352626372113 | D23: =10^(D22/10) -> 1.0298258253252419 | E23: =10^(E22/10) -> 1.0436579442802056 | F23: =10^(F22/10) -> 1.0531736871297162 | G23: =10^(G22/10) -> 1.0641015810621659 | H23: =10^(H22/10) -> 1.0804079020986876 | I23: =10^(I22/10) -> 1.0964357553122348
A24: SWR | B24: |rho|
A25: 1 | B25: =(A25-1)/(A25+1) -> 0.000 | C25: =10*LOG10((C$23^2 - $B25^2)/(C$23*(1-$B25^2)))-C$22 -> -3.0531133177191805E-16 | D25: =10*LOG10((D$23^2 - $B25^2)/(D$23*(1-$B25^2)))-D$22 -> 0.000 | E25: =10*LOG10((E$23^2 - $B25^2)/(E$23*(1-$B25^2)))-E$22 -> -4.163336342344337E-16 | F25: =10*LOG10((F$23^2 - $B25^2)/(F$23*(1-$B25^2)))-F$22 -> 3.6082248300317588E-16 | G25: =10*LOG10((G$23^2 - $B25^2)/(G$23*(1-$B25^2)))-G$22 -> 0.000 | H25: =10*LOG10((H$23^2 - $B25^2)/(H$23*(1-$B25^2)))-H$22 -> 0.000 | I25: =10*LOG10((I$23^2 - $B25^2)/(I$23*(1-$B25^2)))-I$22 -> 0.000
A26: 1.5 | B26: =(A26-1)/(A26+1) -> 00.2 | C26: =10*LOG10((C$23^2 - $B26^2)/(C$23*(1-$B26^2)))-C$22 -> 7.2711346349628864E-3 | D26: =10*LOG10((D$23^2 - $B26^2)/(D$23*(1-$B26^2)))-D$22 -> 1.0317649528025025E-2 | E26: =10*LOG10((E$23^2 - $B26^2)/(E$23*(1-$B26^2)))-E$22 -> 1.4797491814967256E-2 | F26: =10*LOG10((F$23^2 - $B26^2)/(F$23*(1-$B26^2)))-F$22 -> 1.7774872269499919E-2 | G26: =10*LOG10((G$23^2 - $B26^2)/(G$23*(1-$B26^2)))-G$22 -> 2.1093643005259954E-2 | H26: =10*LOG10((H$23^2 - $B26^2)/(H$23*(1-$B26^2)))-H$22 -> 2.5855407077593373E-2 | I26: =10*LOG10((I$23^2 - $B26^2)/(I$23*(1-$B26^2)))-I$22 -> 3.0325584007284412E-2
A27: 2 | B27: =(A27-1)/(A27+1) -> 0.33333333333333331 | C27: =10*LOG10((C$23^2 - $B27^2)/(C$23*(1-$B27^2)))-C$22 -> 2.1776984611283301E-2 | D27: =10*LOG10((D$23^2 - $B27^2)/(D$23*(1-$B27^2)))-D$22 -> 3.0879702735075232E-2 | E27: =10*LOG10((E$23^2 - $B27^2)/(E$23*(1-$B27^2)))-E$22 -> 4.4242072821225026E-2 | F27: =10*LOG10((F$23^2 - $B27^2)/(F$23*(1-$B27^2)))-F$22 -> 5.3107846550130455E-2 | G27: =10*LOG10((G$23^2 - $B27^2)/(G$23*(1-$B27^2)))-G$22 -> 6.2976040015284285E-2 | H27: =10*LOG10((H$23^2 - $B27^2)/(H$23*(1-$B27^2)))-H$22 -> 7.7108968483656504E-2 | I27: =10*LOG10((I$23^2 - $B27^2)/(I$23*(1-$B27^2)))-I$22 -> 9.0348785425030831E-2
A28: 5 | B28: =(A28-1)/(A28+1) -> 0.66666666666666663 | C28: =10*LOG10((C$23^2 - $B28^2)/(C$23*(1-$B28^2)))-C$22 -> 0.13752218645573505 | D28: =10*LOG10((D$23^2 - $B28^2)/(D$23*(1-$B28^2)))-D$22 -> 0.19393891172950939 | E28: =10*LOG10((E$23^2 - $B28^2)/(E$23*(1-$B28^2)))-E$22 -> 0.27565985751771493 | F28: =10*LOG10((F$23^2 - $B28^2)/(F$23*(1-$B28^2)))-F$22 -> 0.3291802678000314 | G28: =10*LOG10((G$23^2 - $B28^2)/(G$23*(1-$B28^2)))-G$22 -> 0.38811264221614961 | H28: =10*LOG10((H$23^2 - $B28^2)/(H$23*(1-$B28^2)))-H$22 -> 0.47137250080473003 | I28: =10*LOG10((I$23^2 - $B28^2)/(I$23*(1-$B28^2)))-I$22 -> 0.5481884325005637
A29: 10 | B29: =(A29-1)/(A29+1) -> 0.81818181818181823 | C29: =10*LOG10((C$23^2 - $B29^2)/(C$23*(1-$B29^2)))-C$22 -> 0.34000921989724325 | D29: =10*LOG10((D$23^2 - $B29^2)/(D$23*(1-$B29^2)))-D$22 -> 0.4750756058357592 | E29: =10*LOG10((E$23^2 - $B29^2)/(E$23*(1-$B29^2)))-E$22 -> 0.66651878110337659 | F29: =10*LOG10((F$23^2 - $B29^2)/(F$23*(1-$B29^2)))-F$22 -> 0.78934513481863455 | G29: =10*LOG10((G$23^2 - $B29^2)/(G$23*(1-$B29^2)))-G$22 -> 0.92237645444926541 | H29: =10*LOG10((H$23^2 - $B29^2)/(H$23*(1-$B29^2)))-H$22 -> 1.1065688943171124 | I29: =10*LOG10((I$23^2 - $B29^2)/(I$23*(1-$B29^2)))-I$22 -> 1.2728235854650283
A30: 20 | B30: =(A30-1)/(A30+1) -> 0.90476190476190477 | C30: =10*LOG10((C$23^2 - $B30^2)/(C$23*(1-$B30^2)))-C$22 -> 0.72423481781774057 | D30: =10*LOG10((D$23^2 - $B30^2)/(D$23*(1-$B30^2)))-D$22 -> 0.9954151330053771 | E30: =10*LOG10((E$23^2 - $B30^2)/(E$23*(1-$B30^2)))-E$22 -> 1.3660464352635662 | F30: =10*LOG10((F$23^2 - $B30^2)/(F$23*(1-$B30^2)))-F$22 -> 1.5961538448101851 | G30: =10*LOG10((G$23^2 - $B30^2)/(G$23*(1-$B30^2)))-G$22 -> 1.8392196079046363 | H30: =10*LOG10((H$23^2 - $B30^2)/(H$23*(1-$B30^2)))-H$22 -> 2.1660901723907227 | I30: =10*LOG10((I$23^2 - $B30^2)/(I$23*(1-$B30^2)))-I$22 -> 2.452350770845388
A31: 50 | B31: =(A31-1)/(A31+1) -> 0.96078431372549022 | C31: =10*LOG10((C$23^2 - $B31^2)/(C$23*(1-$B31^2)))-C$22 -> 1.7107854877936224 | D31: =10*LOG10((D$23^2 - $B31^2)/(D$23*(1-$B31^2)))-D$22 -> 2.2667930242461622 | E31: =10*LOG10((E$23^2 - $B31^2)/(E$23*(1-$B31^2)))-E$22 -> 2.9740390496496336 | F31: =10*LOG10((F$23^2 - $B31^2)/(F$23*(1-$B31^2)))-F$22 -> 3.387827877350011 | G31: =10*LOG10((G$23^2 - $B31^2)/(G$23*(1-$B31^2)))-G$22 -> 3.8071764560140928 | H31: =10*LOG10((H$23^2 - $B31^2)/(H$23*(1-$B31^2)))-H$22 -> 4.3463558197598822 | I31: =10*LOG10((I$23^2 - $B31^2)/(I$23*(1-$B31^2)))-I$22 -> 4.79849143042546
A32: 100 | B32: =(A32-1)/(A32+1) -> 0.98019801980198018 | C32: =10*LOG10((C$23^2 - $B32^2)/(C$23*(1-$B32^2)))-C$22 -> 2.9784333429694336 | D32: =10*LOG10((D$23^2 - $B32^2)/(D$23*(1-$B32^2)))-D$22 -> 3.7998148027323864 | E32: =10*LOG10((E$23^2 - $B32^2)/(E$23*(1-$B32^2)))-E$22 -> 4.7814554152050501 | F32: =10*LOG10((F$23^2 - $B32^2)/(F$23*(1-$B32^2)))-F$22 -> 5.3297760766460556 | G32: =10*LOG10((G$23^2 - $B32^2)/(G$23*(1-$B32^2)))-G$22 -> 5.8694151784335524 | H32: =10*LOG10((H$23^2 - $B32^2)/(H$23*(1-$B32^2)))-H$22 -> 6.5431274794533412 | I32: =10*LOG10((I$23^2 - $B32^2)/(I$23*(1-$B32^2)))-I$22 -> 7.0932343082917022
A37: Length | B37: 10 | J37: metres
A38: Matched loss | C38: =$B37*$B$2*(C$4/$B$3)^0.54 -> 0.17826236604145737 | D38: =$B37*$B$2*(D$4/$B$3)^0.54 -> 0.25527557184050298 | E38: =$B37*$B$2*(E$4/$B$3)^0.54 -> 0.37116366579931798 | F38: =$B37*$B$2*(F$4/$B$3)^0.54 -> 00.45 | G38: =$B37*$B$2*(G$4/$B$3)^0.54 -> 0.53966176950006872 | H38: =$B37*$B$2*(H$4/$B$3)^0.54 -> 0.67175503909955081 | I38: =$B37*$B$2*(I$4/$B$3)^0.54 -> 0.79966379312459346 | J38: dB
A39: a = 10^(ML/10) | C39: =10^(C38/10) -> 1.0419004763910569 | D39: =10^(D38/10) -> 1.0605412305068156 | E39: =10^(E38/10) -> 1.0892219046591851 | F39: =10^(F38/10) -> 1.109174815262401 | G39: =10^(G38/10) -> 1.1323121748190013 | H39: =10^(H38/10) -> 1.1672812349172874 | I39: =10^(I38/10) -> 1.2021713655271109
A40: SWR | B40: |rho|
A41: 1 | B41: =(A41-1)/(A41+1) -> 0.000 | C41: =10*LOG10((C$39^2 - $B41^2)/(C$39*(1-$B41^2)))-C$38 -> 3.3306690738754696E-16 | D41: =10*LOG10((D$39^2 - $B41^2)/(D$39*(1-$B41^2)))-D$38 -> 0.000 | E41: =10*LOG10((E$39^2 - $B41^2)/(E$39*(1-$B41^2)))-E$38 -> 0.000 | F41: =10*LOG10((F$39^2 - $B41^2)/(F$39*(1-$B41^2)))-F$38 -> 0.000 | G41: =10*LOG10((G$39^2 - $B41^2)/(G$39*(1-$B41^2)))-G$38 -> 0.000 | H41: =10*LOG10((H$39^2 - $B41^2)/(H$39*(1-$B41^2)))-H$38 -> 0.000 | I41: =10*LOG10((I$39^2 - $B41^2)/(I$39*(1-$B41^2)))-I$38 -> 0.000
A42: 1.5 | B42: =(A42-1)/(A42+1) -> 00.2 | C42: =10*LOG10((C$39^2 - $B42^2)/(C$39*(1-$B42^2)))-C$38 -> 1.4238426959406691E-2 | D42: =10*LOG10((D$39^2 - $B42^2)/(D$39*(1-$B42^2)))-D$38 -> 2.0023911987319121E-2 | E42: =10*LOG10((E$39^2 - $B42^2)/(E$39*(1-$B42^2)))-E$38 -> 2.8338619866343562E-2 | F42: =10*LOG10((F$39^2 - $B42^2)/(F$39*(1-$B42^2)))-F$38 -> 3.3738060848902796E-2 | G42: =10*LOG10((G$39^2 - $B42^2)/(G$39*(1-$B42^2)))-G$38 -> 3.9637651989385292E-2 | H42: =10*LOG10((H$39^2 - $B42^2)/(H$39*(1-$B42^2)))-H$38 -> 4.7883751801306329E-2 | I42: =10*LOG10((I$39^2 - $B42^2)/(I$39*(1-$B42^2)))-I$38 -> 5.5390919820889839E-2
A43: 2 | B43: =(A43-1)/(A43+1) -> 0.33333333333333331 | C43: =10*LOG10((C$39^2 - $B43^2)/(C$39*(1-$B43^2)))-C$38 -> 4.2575998630203005E-2 | D43: =10*LOG10((D$39^2 - $B43^2)/(D$39*(1-$B43^2)))-D$38 -> 5.9796875027361418E-2 | E43: =10*LOG10((E$39^2 - $B43^2)/(E$39*(1-$B43^2)))-E$38 -> 8.4467074554615051E-2 | F43: =10*LOG10((F$39^2 - $B43^2)/(F$39*(1-$B43^2)))-F$38 -> 0.10043793886541064 | G43: =10*LOG10((G$39^2 - $B43^2)/(G$39*(1-$B43^2)))-G$38 -> 0.11784388385836453 | H43: =10*LOG10((H$39^2 - $B43^2)/(H$39*(1-$B43^2)))-H$38 -> 0.14209593203680715 | I43: =10*LOG10((I$39^2 - $B43^2)/(I$39*(1-$B43^2)))-I$38 -> 0.16409736912250905
A44: 5 | B44: =(A44-1)/(A44+1) -> 0.66666666666666663 | C44: =10*LOG10((C$39^2 - $B44^2)/(C$39*(1-$B44^2)))-C$38 -> 0.26554044958636114 | D44: =10*LOG10((D$39^2 - $B44^2)/(D$39*(1-$B44^2)))-D$38 -> 0.36919941018763835 | E44: =10*LOG10((E$39^2 - $B44^2)/(E$39*(1-$B44^2)))-E$38 -> 0.51420213650711188 | F44: =10*LOG10((F$39^2 - $B44^2)/(F$39*(1-$B44^2)))-F$38 -> 0.60597974022760215 | G44: =10*LOG10((G$39^2 - $B44^2)/(G$39*(1-$B44^2)))-G$38 -> 0.7042162455769474 | H44: =10*LOG10((H$39^2 - $B44^2)/(H$39*(1-$B44^2)))-H$38 -> 0.83811975187648025 | I44: =10*LOG10((I$39^2 - $B44^2)/(I$39*(1-$B44^2)))-I$38 -> 0.95674696166606121
A45: 10 | B45: =(A45-1)/(A45+1) -> 0.81818181818181823 | C45: =10*LOG10((C$39^2 - $B45^2)/(C$39*(1-$B45^2)))-C$38 -> 0.64307270578110409 | D45: =10*LOG10((D$39^2 - $B45^2)/(D$39*(1-$B45^2)))-D$38 -> 0.87992918812879062 | E45: =10*LOG10((E$39^2 - $B45^2)/(E$39*(1-$B45^2)))-E$38 -> 1.1996879899263988 | F45: =10*LOG10((F$39^2 - $B45^2)/(F$39*(1-$B45^2)))-F$38 -> 1.3956999944486328 | G45: =10*LOG10((G$39^2 - $B45^2)/(G$39*(1-$B45^2)))-G$38 -> 1.6004754960028862 | H45: =10*LOG10((H$39^2 - $B45^2)/(H$39*(1-$B45^2)))-H$38 -> 1.8718530419372765 | I45: =10*LOG10((I$39^2 - $B45^2)/(I$39*(1-$B45^2)))-I$38 -> 2.1053931921858902
A46: 20 | B46: =(A46-1)/(A46+1) -> 0.90476190476190477 | C46: =10*LOG10((C$39^2 - $B46^2)/(C$39*(1-$B46^2)))-C$38 -> 1.3214638732215824 | D46: =10*LOG10((D$39^2 - $B46^2)/(D$39*(1-$B46^2)))-D$38 -> 1.7623285485798865 | E46: =10*LOG10((E$39^2 - $B46^2)/(E$39*(1-$B46^2)))-E$38 -> 2.3273970101876911 | F46: =10*LOG10((F$39^2 - $B46^2)/(F$39*(1-$B46^2)))-F$38 -> 2.6590274482912157 | G46: =10*LOG10((G$39^2 - $B46^2)/(G$39*(1-$B46^2)))-G$38 -> 2.995004265409329 | H46: =10*LOG10((H$39^2 - $B46^2)/(H$39*(1-$B46^2)))-H$38 -> 3.4255767522015232 | I46: =10*LOG10((I$39^2 - $B46^2)/(I$39*(1-$B46^2)))-I$38 -> 3.7842140448634778
A47: 50 | B47: =(A47-1)/(A47+1) -> 0.96078431372549022 | C47: =10*LOG10((C$39^2 - $B47^2)/(C$39*(1-$B47^2)))-C$38 -> 2.891778802544994 | D47: =10*LOG10((D$39^2 - $B47^2)/(D$39*(1-$B47^2)))-D$38 -> 3.6763452433468218 | E47: =10*LOG10((E$39^2 - $B47^2)/(E$39*(1-$B47^2)))-E$38 -> 4.603249528329509 | F47: =10*LOG10((F$39^2 - $B47^2)/(F$39*(1-$B47^2)))-F$38 -> 5.1147822967903416 | G47: =10*LOG10((G$39^2 - $B47^2)/(G$39*(1-$B47^2)))-G$38 -> 5.6130192385600246 | H47: =10*LOG10((H$39^2 - $B47^2)/(H$39*(1-$B47^2)))-H$38 -> 6.2265793051109828 | I47: =10*LOG10((I$39^2 - $B47^2)/(I$39*(1-$B47^2)))-I$38 -> 6.7193918886060358
A48: 100 | B48: =(A48-1)/(A48+1) -> 0.98019801980198018 | C48: =10*LOG10((C$39^2 - $B48^2)/(C$39*(1-$B48^2)))-C$38 -> 4.6703504438418859 | D48: =10*LOG10((D$39^2 - $B48^2)/(D$39*(1-$B48^2)))-D$38 -> 5.7026434255755207 | E48: =10*LOG10((E$39^2 - $B48^2)/(E$39*(1-$B48^2)))-E$38 -> 6.8572030247295643 | F48: =10*LOG10((F$39^2 - $B48^2)/(F$39*(1-$B48^2)))-F$38 -> 7.4711028248820996 | G48: =10*LOG10((G$39^2 - $B48^2)/(G$39*(1-$B48^2)))-G$38 -> 8.0561884510111845 | H48: =10*LOG10((H$39^2 - $B48^2)/(H$39*(1-$B48^2)))-H$38 -> 8.761955503894141 | I48: =10*LOG10((I$39^2 - $B48^2)/(I$39*(1-$B48^2)))-I$38 -> 9.3187908632691183
A54: Length | B54: 30 | J54: metres
A55: Matched loss | C55: =$B54*$B$2*(C$4/$B$3)^0.54 -> 0.53478709812437208 | D55: =$B54*$B$2*(D$4/$B$3)^0.54 -> 0.76582671552150894 | E55: =$B54*$B$2*(E$4/$B$3)^0.54 -> 1.1134909973979539 | F55: =$B54*$B$2*(F$4/$B$3)^0.54 -> 1.350 | G55: =$B54*$B$2*(G$4/$B$3)^0.54 -> 1.6189853085002064 | H55: =$B54*$B$2*(H$4/$B$3)^0.54 -> 2.0152651172986524 | I55: =$B54*$B$2*(I$4/$B$3)^0.54 -> 2.3989913793737805 | J55: dB
A56: a = 10^(ML/10) | C56: =10^(C55/10) -> 1.1310419415066622 | D56: =10^(D55/10) -> 1.1928413114697844 | E56: =10^(E55/10) -> 1.2922576140694644 | F56: =10^(F55/10) -> 1.3645831365889245 | G56: =10^(G55/10) -> 1.4517723838970014 | H56: =10^(H55/10) -> 1.5904737721479207 | I56: =10^(I55/10) -> 1.737397282696443
A57: SWR | B57: Rho
A58: 1 | B58: =(A58-1)/(A58+1) -> 0.000 | C58: =10*LOG10((C$56^2 - $B58^2)/(C$56*(1-$B58^2)))-C$55 -> 0.000 | D58: =10*LOG10((D$56^2 - $B58^2)/(D$56*(1-$B58^2)))-D$55 -> 0.000 | E58: =10*LOG10((E$56^2 - $B58^2)/(E$56*(1-$B58^2)))-E$55 -> 0.000 | F58: =10*LOG10((F$56^2 - $B58^2)/(F$56*(1-$B58^2)))-F$55 -> 0.000 | G58: =10*LOG10((G$56^2 - $B58^2)/(G$56*(1-$B58^2)))-G$55 -> 0.000 | H58: =10*LOG10((H$56^2 - $B58^2)/(H$56*(1-$B58^2)))-H$55 -> 0.000 | I58: =10*LOG10((I$56^2 - $B58^2)/(I$56*(1-$B58^2)))-I$55 -> 0.000
A59: 1.5 | B59: =(A59-1)/(A59+1) -> 00.2 | C59: =10*LOG10((C$56^2 - $B59^2)/(C$56*(1-$B59^2)))-C$55 -> 3.9323332541993272E-2 | D59: =10*LOG10((D$56^2 - $B59^2)/(D$56*(1-$B59^2)))-D$55 -> 5.3449028398718013E-2 | E59: =10*LOG10((E$56^2 - $B59^2)/(E$56*(1-$B59^2)))-E$55 -> 7.199451822651648E-2 | F59: =10*LOG10((F$56^2 - $B59^2)/(F$56*(1-$B59^2)))-F$55 -> 8.2979091182500131E-2 | G59: =10*LOG10((G$56^2 - $B59^2)/(G$56*(1-$B59^2)))-G$55 -> 9.4072721882791699E-2 | H59: =10*LOG10((H$56^2 - $B59^2)/(H$56*(1-$B59^2)))-H$55 -> 0.10806508494071254 | I59: =10*LOG10((I$56^2 - $B59^2)/(I$56*(1-$B59^2)))-I$55 -> 0.11935286497077824
A60: 2 | B60: =(A60-1)/(A60+1) -> 0.33333333333333331 | C60: =10*LOG10((C$56^2 - $B60^2)/(C$56*(1-$B60^2)))-C$55 -> 0.11691768876303732 | D60: =10*LOG10((D$56^2 - $B60^2)/(D$56*(1-$B60^2)))-D$55 -> 0.15841325699031872 | E60: =10*LOG10((E$56^2 - $B60^2)/(E$56*(1-$B60^2)))-E$55 -> 0.21249910531045568 | F60: =10*LOG10((F$56^2 - $B60^2)/(F$56*(1-$B60^2)))-F$55 -> 0.2443272219053092 | G60: =10*LOG10((G$56^2 - $B60^2)/(G$56*(1-$B60^2)))-G$55 -> 0.27631723832640853 | H60: =10*LOG10((H$56^2 - $B60^2)/(H$56*(1-$B60^2)))-H$55 -> 0.31644820129072082 | I60: =10*LOG10((I$56^2 - $B60^2)/(I$56*(1-$B60^2)))-I$55 -> 0.34864739800566591
A61: 5 | B61: =(A61-1)/(A61+1) -> 0.66666666666666663 | C61: =10*LOG10((C$56^2 - $B61^2)/(C$56*(1-$B61^2)))-C$55 -> 0.69903471629916969 | D61: =10*LOG10((D$56^2 - $B61^2)/(D$56*(1-$B61^2)))-D$55 -> 0.92635124578830819 | E61: =10*LOG10((E$56^2 - $B61^2)/(E$56*(1-$B61^2)))-E$55 -> 1.208824105951172 | F61: =10*LOG10((F$56^2 - $B61^2)/(F$56*(1-$B61^2)))-F$55 -> 1.3683928859358552 | G61: =10*LOG10((G$56^2 - $B61^2)/(G$56*(1-$B61^2)))-G$55 -> 1.5241955682260391 | H61: =10*LOG10((H$56^2 - $B61^2)/(H$56*(1-$B61^2)))-H$55 -> 1.713593615837627 | I61: =10*LOG10((I$56^2 - $B61^2)/(I$56*(1-$B61^2)))-I$55 -> 1.8610046606433657
A62: 10 | B62: =(A62-1)/(A62+1) -> 0.81818181818181823 | C62: =10*LOG10((C$56^2 - $B62^2)/(C$56*(1-$B62^2)))-C$55 -> 1.58979868014186 | D62: =10*LOG10((D$56^2 - $B62^2)/(D$56*(1-$B62^2)))-D$55 -> 2.0461384293858811 | E62: =10*LOG10((E$56^2 - $B62^2)/(E$56*(1-$B62^2)))-E$55 -> 2.5824785513199275 | F62: =10*LOG10((F$56^2 - $B62^2)/(F$56*(1-$B62^2)))-F$55 -> 2.8724408995126485 | G62: =10*LOG10((G$56^2 - $B62^2)/(G$56*(1-$B62^2)))-G$55 -> 3.1475411427520372 | H62: =10*LOG10((H$56^2 - $B62^2)/(H$56*(1-$B62^2)))-H$55 -> 3.4722857113371295 | I62: =10*LOG10((I$56^2 - $B62^2)/(I$56*(1-$B62^2)))-I$55 -> 3.7183375313573035
A63: 20 | B63: =(A63-1)/(A63+1) -> 0.90476190476190477 | C63: =10*LOG10((C$56^2 - $B63^2)/(C$56*(1-$B63^2)))-C$55 -> 2.9777335399013038 | D63: =10*LOG10((D$56^2 - $B63^2)/(D$56*(1-$B63^2)))-D$55 -> 3.6941881356286044 | E63: =10*LOG10((E$56^2 - $B63^2)/(E$56*(1-$B63^2)))-E$55 -> 4.4875121628638421 | F63: =10*LOG10((F$56^2 - $B63^2)/(F$56*(1-$B63^2)))-F$55 -> 4.8983815600184801 | G63: =10*LOG10((G$56^2 - $B63^2)/(G$56*(1-$B63^2)))-G$55 -> 5.278209503386103 | H63: =10*LOG10((H$56^2 - $B63^2)/(H$56*(1-$B63^2)))-H$55 -> 5.7154881607719297 | I63: =10*LOG10((I$56^2 - $B63^2)/(I$56*(1-$B63^2)))-I$55 -> 6.0396416620566384
A64: 50 | B64: =(A64-1)/(A64+1) -> 0.96078431372549022 | C64: =10*LOG10((C$56^2 - $B64^2)/(C$56*(1-$B64^2)))-C$55 -> 5.5878512460667071 | D64: =10*LOG10((D$56^2 - $B64^2)/(D$56*(1-$B64^2)))-D$55 -> 6.5970989273697853 | E64: =10*LOG10((E$56^2 - $B64^2)/(E$56*(1-$B64^2)))-E$55 -> 7.6462998322625806 | F64: =10*LOG10((F$56^2 - $B64^2)/(F$56*(1-$B64^2)))-F$55 -> 8.1676699417411136 | G64: =10*LOG10((G$56^2 - $B64^2)/(G$56*(1-$B64^2)))-G$55 -> 8.6386176328562225 | H64: =10*LOG10((H$56^2 - $B64^2)/(H$56*(1-$B64^2)))-H$55 -> 9.1693815011310971 | I64: =10*LOG10((I$56^2 - $B64^2)/(I$56*(1-$B64^2)))-I$55 -> 9.5558789513987303
A65: 100 | B65: =(A65-1)/(A65+1) -> 0.98019801980198018 | C65: =10*LOG10((C$56^2 - $B65^2)/(C$56*(1-$B65^2)))-C$55 -> 8.0269074903227438 | D65: =10*LOG10((D$56^2 - $B65^2)/(D$56*(1-$B65^2)))-D$55 -> 9.1813668653332154 | E65: =10*LOG10((E$56^2 - $B65^2)/(E$56*(1-$B65^2)))-E$55 -> 10.346175093159882 | F65: =10*LOG10((F$56^2 - $B65^2)/(F$56*(1-$B65^2)))-F$55 -> 10.914516351573063 | G65: =10*LOG10((G$56^2 - $B65^2)/(G$56*(1-$B65^2)))-G$55 -> 11.422941677282832 | H65: =10*LOG10((H$56^2 - $B65^2)/(H$56*(1-$B65^2)))-H$55 -> 11.991024796137154 | I65: =10*LOG10((I$56^2 - $B65^2)/(I$56*(1-$B65^2)))-I$55 -> 12.4017944604742