A1: Feeder type | B1: 600R open-wire
A2: Matched loss | B2: 3.5000000000000001E-3 | C2: dB/m
A3: at | B3: 30 | C3: MHz
A4: Frequency | C4: 1.8 | D4: 3.5 | E4: 7 | F4: 10 | G4: 14 | H4: 21 | I4: 29 | J4: MHz
A5: Length | B5: 2.5 | J5: metres
A6: Matched loss | C6: =$B5*$B$2*(C$4/$B$3)^0.51 -> 2.0838439370235323E-3 | D6: =$B5*$B$2*(D$4/$B$3)^0.51 -> 2.9251686866030718E-3 | E6: =$B5*$B$2*(E$4/$B$3)^0.51 -> 4.1655870403115346E-3 | F6: =$B5*$B$2*(F$4/$B$3)^0.51 -> 4.996618747376059E-3 | G6: =$B5*$B$2*(G$4/$B$3)^0.51 -> 5.932005039532267E-3 | H6: =$B5*$B$2*(H$4/$B$3)^0.51 -> 7.2947103722626055E-3 | I6: =$B5*$B$2*(I$4/$B$3)^0.51 -> 8.6000146695094995E-3 | J6: dB
A7: a = 10^(ML/10) | C7: =10^(C6/10) -> 1.0004799379319245 | D7: =10^(D6/10) -> 1.000673771863583 | E7: =10^(E6/10) -> 1.0009596220051034 | F7: =10^(F6/10) -> 1.0011511760794145 | G7: =10^(G6/10) -> 1.0013668278965024 | H7: =10^(H6/10) -> 1.0016810805704284 | I7: =10^(I6/10) -> 1.0019821885011815
A8: SWR | B8: |rho|
A9: 1 | B9: =(A9-1)/(A9+1) -> 0.000 | C9: =10*LOG10((C$7^2 - $B9^2)/(C$7*(1-$B9^2)))-C$6 -> 8.4134088584875144E-17 | D9: =10*LOG10((D$7^2 - $B9^2)/(D$7*(1-$B9^2)))-D$6 -> -2.0469737016526324E-16 | E9: =10*LOG10((E$7^2 - $B9^2)/(E$7*(1-$B9^2)))-E$6 -> -4.3021142204224816E-16 | F9: =10*LOG10((F$7^2 - $B9^2)/(F$7*(1-$B9^2)))-F$6 -> -8.9338259012805565E-17 | G9: =10*LOG10((G$7^2 - $B9^2)/(G$7*(1-$B9^2)))-G$6 -> -1.214306433183765E-16 | H9: =10*LOG10((H$7^2 - $B9^2)/(H$7*(1-$B9^2)))-H$6 -> -1.0408340855860843E-16 | I9: =10*LOG10((I$7^2 - $B9^2)/(I$7*(1-$B9^2)))-I$6 -> 4.3715031594615539E-16
A10: 1.5 | B10: =(A10-1)/(A10+1) -> 00.2 | C10: =10*LOG10((C$7^2 - $B10^2)/(C$7*(1-$B10^2)))-C$6 -> 1.735668967115531E-4 | D10: =10*LOG10((D$7^2 - $B10^2)/(D$7*(1-$B10^2)))-D$6 -> 2.4359311323706801E-4 | E10: =10*LOG10((E$7^2 - $B10^2)/(E$7*(1-$B10^2)))-E$6 -> 3.4678566429723577E-4 | F10: =10*LOG10((F$7^2 - $B10^2)/(F$7*(1-$B10^2)))-F$6 -> 4.1588629264533491E-4 | G10: =10*LOG10((G$7^2 - $B10^2)/(G$7*(1-$B10^2)))-G$6 -> 4.9363110509206484E-4 | H10: =10*LOG10((H$7^2 - $B10^2)/(H$7*(1-$B10^2)))-H$6 -> 6.068302175931857E-4 | I10: =10*LOG10((I$7^2 - $B10^2)/(I$7*(1-$B10^2)))-I$6 -> 7.1519170424548875E-4
A11: 2 | B11: =(A11-1)/(A11+1) -> 0.33333333333333331 | C11: =10*LOG10((C$7^2 - $B11^2)/(C$7*(1-$B11^2)))-C$6 -> 5.2067988158374179E-4 | D11: =10*LOG10((D$7^2 - $B11^2)/(D$7*(1-$B11^2)))-D$6 -> 7.3073835457766788E-4 | E11: =10*LOG10((E$7^2 - $B11^2)/(E$7*(1-$B11^2)))-E$6 -> 1.0402739310764776E-3 | F11: =10*LOG10((F$7^2 - $B11^2)/(F$7*(1-$B11^2)))-F$6 -> 1.2475394194925203E-3 | G11: =10*LOG10((G$7^2 - $B11^2)/(G$7*(1-$B11^2)))-G$6 -> 1.4807250247342377E-3 | H11: =10*LOG10((H$7^2 - $B11^2)/(H$7*(1-$B11^2)))-H$6 -> 1.8202363388101946E-3 | I11: =10*LOG10((I$7^2 - $B11^2)/(I$7*(1-$B11^2)))-I$6 -> 2.1452218785722142E-3
A12: 5 | B12: =(A12-1)/(A12+1) -> 0.66666666666666663 | C12: =10*LOG10((C$7^2 - $B12^2)/(C$7*(1-$B12^2)))-C$6 -> 3.3312730496979199E-3 | D12: =10*LOG10((D$7^2 - $B12^2)/(D$7*(1-$B12^2)))-D$6 -> 4.6746022447460428E-3 | E12: =10*LOG10((E$7^2 - $B12^2)/(E$7*(1-$B12^2)))-E$6 -> 6.6534514014076002E-3 | F12: =10*LOG10((F$7^2 - $B12^2)/(F$7*(1-$B12^2)))-F$6 -> 7.9780667446503091E-3 | G12: =10*LOG10((G$7^2 - $B12^2)/(G$7*(1-$B12^2)))-G$6 -> 9.4679279886029262E-3 | H12: =10*LOG10((H$7^2 - $B12^2)/(H$7*(1-$B12^2)))-H$6 -> 1.1636351238908625E-2 | I12: =10*LOG10((I$7^2 - $B12^2)/(I$7*(1-$B12^2)))-I$6 -> 1.371114486685323E-2
A13: 10 | B13: =(A13-1)/(A13+1) -> 0.81818181818181823 | C13: =10*LOG10((C$7^2 - $B13^2)/(C$7*(1-$B13^2)))-C$6 -> 8.4273379690177688E-3 | D13: =10*LOG10((D$7^2 - $B13^2)/(D$7*(1-$B13^2)))-D$6 -> 1.1822849965022936E-2 | E13: =10*LOG10((E$7^2 - $B13^2)/(E$7*(1-$B13^2)))-E$6 -> 1.6821835486378504E-2 | F13: =10*LOG10((F$7^2 - $B13^2)/(F$7*(1-$B13^2)))-F$6 -> 2.0166149043922204E-2 | G13: =10*LOG10((G$7^2 - $B13^2)/(G$7*(1-$B13^2)))-G$6 -> 2.392580888843775E-2 | H13: =10*LOG10((H$7^2 - $B13^2)/(H$7*(1-$B13^2)))-H$6 -> 2.9394309684165211E-2 | I13: =10*LOG10((I$7^2 - $B13^2)/(I$7*(1-$B13^2)))-I$6 -> 3.4622801628530507E-2
A14: 20 | B14: =(A14-1)/(A14+1) -> 0.90476190476190477 | C14: =10*LOG10((C$7^2 - $B14^2)/(C$7*(1-$B14^2)))-C$6 -> 1.8757106345531887E-2 | D14: =10*LOG10((D$7^2 - $B14^2)/(D$7*(1-$B14^2)))-D$6 -> 2.630206672762276E-2 | E14: =10*LOG10((E$7^2 - $B14^2)/(E$7*(1-$B14^2)))-E$6 -> 3.7396912191194696E-2 | F14: =10*LOG10((F$7^2 - $B14^2)/(F$7*(1-$B14^2)))-F$6 -> 4.481066591398411E-2 | G14: =10*LOG10((G$7^2 - $B14^2)/(G$7*(1-$B14^2)))-G$6 -> 5.3136886425905958E-2 | H14: =10*LOG10((H$7^2 - $B14^2)/(H$7*(1-$B14^2)))-H$6 -> 6.5231943436852249E-2 | I14: =10*LOG10((I$7^2 - $B14^2)/(I$7*(1-$B14^2)))-I$6 -> 7.6778934788843456E-2
A15: 50 | B15: =(A15-1)/(A15+1) -> 0.96078431372549022 | C15: =10*LOG10((C$7^2 - $B15^2)/(C$7*(1-$B15^2)))-C$6 -> 4.9723357161853762E-2 | D15: =10*LOG10((D$7^2 - $B15^2)/(D$7*(1-$B15^2)))-D$6 -> 6.9624917730722574E-2 | E15: =10*LOG10((E$7^2 - $B15^2)/(E$7*(1-$B15^2)))-E$6 -> 9.8787758342309628E-2 | F15: =10*LOG10((F$7^2 - $B15^2)/(F$7*(1-$B15^2)))-F$6 -> 0.11820749836458583 | G15: =10*LOG10((G$7^2 - $B15^2)/(G$7*(1-$B15^2)))-G$6 -> 0.13995361898438141 | H15: =10*LOG10((H$7^2 - $B15^2)/(H$7*(1-$B15^2)))-H$6 -> 0.17142397248935137 | I15: =10*LOG10((I$7^2 - $B15^2)/(I$7*(1-$B15^2)))-I$6 -> 0.20133804228352398
A16: 100 | B16: =(A16-1)/(A16+1) -> 0.98019801980198018 | C16: =10*LOG10((C$7^2 - $B16^2)/(C$7*(1-$B16^2)))-C$6 -> 0.10088881256370076 | D16: =10*LOG10((D$7^2 - $B16^2)/(D$7*(1-$B16^2)))-D$6 -> 0.14093952116265634 | E16: =10*LOG10((E$7^2 - $B16^2)/(E$7*(1-$B16^2)))-E$6 -> 0.1992953840266935 | F16: =10*LOG10((F$7^2 - $B16^2)/(F$7*(1-$B16^2)))-F$6 -> 0.23793907620165072 | G16: =10*LOG10((G$7^2 - $B16^2)/(G$7*(1-$B16^2)))-G$6 -> 0.28101050480254408 | H16: =10*LOG10((H$7^2 - $B16^2)/(H$7*(1-$B16^2)))-H$6 -> 0.34297128983318764 | I16: =10*LOG10((I$7^2 - $B16^2)/(I$7*(1-$B16^2)))-I$6 -> 0.40146880350770048
A21: Length | B21: 10 | J21: metres
A22: Matched loss | C22: =$B21*$B$2*(C$4/$B$3)^0.51 -> 8.3353757480941291E-3 | D22: =$B21*$B$2*(D$4/$B$3)^0.51 -> 1.1700674746412287E-2 | E22: =$B21*$B$2*(E$4/$B$3)^0.51 -> 1.6662348161246138E-2 | F22: =$B21*$B$2*(F$4/$B$3)^0.51 -> 1.9986474989504236E-2 | G22: =$B21*$B$2*(G$4/$B$3)^0.51 -> 2.3728020158129068E-2 | H22: =$B21*$B$2*(H$4/$B$3)^0.51 -> 2.9178841489050422E-2 | I22: =$B21*$B$2*(I$4/$B$3)^0.51 -> 3.4400058678037998E-2 | J22: dB
A23: a = 10^(ML/10) | C23: =10^(C22/10) -> 1.0019211342124583 | D23: =10^(D22/10) -> 1.0026978124891679 | E23: =10^(E22/10) -> 1.0038440168023832 | F23: =10^(F22/10) -> 1.0046126616597926 | G23: =10^(G22/10) -> 1.0054785311146248 | H23: =10^(H22/10) -> 1.0067412974841548 | I23: =10^(I22/10) -> 1.0079523596003279
A24: SWR | B24: |rho|
A25: 1 | B25: =(A25-1)/(A25+1) -> 0.000 | C25: =10*LOG10((C$23^2 - $B25^2)/(C$23*(1-$B25^2)))-C$22 -> 2.3071822230491534E-16 | D25: =10*LOG10((D$23^2 - $B25^2)/(D$23*(1-$B25^2)))-D$22 -> -3.5908775952719907E-16 | E25: =10*LOG10((E$23^2 - $B25^2)/(E$23*(1-$B25^2)))-E$22 -> 0.000 | F25: =10*LOG10((F$23^2 - $B25^2)/(F$23*(1-$B25^2)))-F$22 -> -3.4694469519536142E-16 | G25: =10*LOG10((G$23^2 - $B25^2)/(G$23*(1-$B25^2)))-G$22 -> 4.649058915617843E-16 | H25: =10*LOG10((H$23^2 - $B25^2)/(H$23*(1-$B25^2)))-H$22 -> -3.9551695252271202E-16 | I25: =10*LOG10((I$23^2 - $B25^2)/(I$23*(1-$B25^2)))-I$22 -> 2.6367796834847468E-16
A26: 1.5 | B26: =(A26-1)/(A26+1) -> 00.2 | C26: =10*LOG10((C$23^2 - $B26^2)/(C$23*(1-$B26^2)))-C$22 -> 6.932278520736853E-4 | D26: =10*LOG10((D$23^2 - $B26^2)/(D$23*(1-$B26^2)))-D$22 -> 9.7232511078970511E-4 | E26: =10*LOG10((E$23^2 - $B26^2)/(E$23*(1-$B26^2)))-E$22 -> 1.3829950887414288E-3 | F26: =10*LOG10((F$23^2 - $B26^2)/(F$23*(1-$B26^2)))-F$22 -> 1.6575817715621145E-3 | G26: =10*LOG10((G$23^2 - $B26^2)/(G$23*(1-$B26^2)))-G$22 -> 1.966125813975525E-3 | H26: =10*LOG10((H$23^2 - $B26^2)/(H$23*(1-$B26^2)))-H$22 -> 2.4146347397724852E-3 | I26: =10*LOG10((I$23^2 - $B26^2)/(I$23*(1-$B26^2)))-I$22 -> 2.8431534983311413E-3
A27: 2 | B27: =(A27-1)/(A27+1) -> 0.33333333333333331 | C27: =10*LOG10((C$23^2 - $B27^2)/(C$23*(1-$B27^2)))-C$22 -> 2.079351682067165E-3 | D27: =10*LOG10((D$23^2 - $B27^2)/(D$23*(1-$B27^2)))-D$22 -> 2.9163225056368473E-3 | E27: =10*LOG10((E$23^2 - $B27^2)/(E$23*(1-$B27^2)))-E$22 -> 4.1476647376761759E-3 | F27: =10*LOG10((F$23^2 - $B27^2)/(F$23*(1-$B27^2)))-F$22 -> 4.9708485619867418E-3 | G27: =10*LOG10((G$23^2 - $B27^2)/(G$23*(1-$B27^2)))-G$22 -> 5.8957091581409785E-3 | H27: =10*LOG10((H$23^2 - $B27^2)/(H$23*(1-$B27^2)))-H$22 -> 7.23988040787929E-3 | I27: =10*LOG10((I$23^2 - $B27^2)/(I$23*(1-$B27^2)))-I$22 -> 8.5238826811693813E-3
A28: 5 | B28: =(A28-1)/(A28+1) -> 0.66666666666666663 | C28: =10*LOG10((C$23^2 - $B28^2)/(C$23*(1-$B28^2)))-C$22 -> 1.3290679653994613E-2 | D28: =10*LOG10((D$23^2 - $B28^2)/(D$23*(1-$B28^2)))-D$22 -> 1.8630713139067785E-2 | E28: =10*LOG10((E$23^2 - $B28^2)/(E$23*(1-$B28^2)))-E$22 -> 2.6476861430222893E-2 | F28: =10*LOG10((F$23^2 - $B28^2)/(F$23*(1-$B28^2)))-F$22 -> 3.1715556028357905E-2 | G28: =10*LOG10((G$23^2 - $B28^2)/(G$23*(1-$B28^2)))-G$22 -> 3.7594969726417779E-2 | H28: =10*LOG10((H$23^2 - $B28^2)/(H$23*(1-$B28^2)))-H$22 -> 4.6128036362940272E-2 | I28: =10*LOG10((I$23^2 - $B28^2)/(I$23*(1-$B28^2)))-I$22 -> 5.4265970908728867E-2
A29: 10 | B29: =(A29-1)/(A29+1) -> 0.81818181818181823 | C29: =10*LOG10((C$23^2 - $B29^2)/(C$23*(1-$B29^2)))-C$22 -> 3.3563533550990308E-2 | D29: =10*LOG10((D$23^2 - $B29^2)/(D$23*(1-$B29^2)))-D$22 -> 4.700499584382771E-2 | E29: =10*LOG10((E$23^2 - $B29^2)/(E$23*(1-$B29^2)))-E$22 -> 6.6709290963257867E-2 | F29: =10*LOG10((F$23^2 - $B29^2)/(F$23*(1-$B29^2)))-F$22 -> 7.983553161853435E-2 | G29: =10*LOG10((G$23^2 - $B29^2)/(G$23*(1-$B29^2)))-G$22 -> 9.4538861220435685E-2 | H29: =10*LOG10((H$23^2 - $B29^2)/(H$23*(1-$B29^2)))-H$22 -> 0.11582553200377702 | I29: =10*LOG10((I$23^2 - $B29^2)/(I$23*(1-$B29^2)))-I$22 -> 0.1360684866851217
A30: 20 | B30: =(A30-1)/(A30+1) -> 0.90476190476190477 | C30: =10*LOG10((C$23^2 - $B30^2)/(C$23*(1-$B30^2)))-C$22 -> 7.444092464322756E-2 | D30: =10*LOG10((D$23^2 - $B30^2)/(D$23*(1-$B30^2)))-D$22 -> 0.1040579556251707 | E30: =10*LOG10((E$23^2 - $B30^2)/(E$23*(1-$B30^2)))-E$22 -> 0.14727655222131281 | F30: =10*LOG10((F$23^2 - $B30^2)/(F$23*(1-$B30^2)))-F$22 -> 0.17593802079785542 | G30: =10*LOG10((G$23^2 - $B30^2)/(G$23*(1-$B30^2)))-G$22 -> 0.20792202424306716 | H30: =10*LOG10((H$23^2 - $B30^2)/(H$23*(1-$B30^2)))-H$22 -> 0.25400285541760703 | I30: =10*LOG10((I$23^2 - $B30^2)/(I$23*(1-$B30^2)))-I$22 -> 0.29758214160278607
A31: 50 | B31: =(A31-1)/(A31+1) -> 0.96078431372549022 | C31: =10*LOG10((C$23^2 - $B31^2)/(C$23*(1-$B31^2)))-C$22 -> 0.19529130866816224 | D31: =10*LOG10((D$23^2 - $B31^2)/(D$23*(1-$B31^2)))-D$22 -> 0.27151089213512991 | E31: =10*LOG10((E$23^2 - $B31^2)/(E$23*(1-$B31^2)))-E$22 -> 0.38129320082342866 | F31: =10*LOG10((F$23^2 - $B31^2)/(F$23*(1-$B31^2)))-F$22 -> 0.45318445567071586 | G31: =10*LOG10((G$23^2 - $B31^2)/(G$23*(1-$B31^2)))-G$22 -> 0.53257662256937444 | H31: =10*LOG10((H$23^2 - $B31^2)/(H$23*(1-$B31^2)))-H$22 -> 0.64546499903809207 | I31: =10*LOG10((I$23^2 - $B31^2)/(I$23*(1-$B31^2)))-I$22 -> 0.75065860365902304
A32: 100 | B32: =(A32-1)/(A32+1) -> 0.98019801980198018 | C32: =10*LOG10((C$23^2 - $B32^2)/(C$23*(1-$B32^2)))-C$22 -> 0.38967528930197848 | D32: =10*LOG10((D$23^2 - $B32^2)/(D$23*(1-$B32^2)))-D$22 -> 0.53721037793345805 | E32: =10*LOG10((E$23^2 - $B32^2)/(E$23*(1-$B32^2)))-E$22 -> 0.74558786229498775 | F32: =10*LOG10((F$23^2 - $B32^2)/(F$23*(1-$B32^2)))-F$22 -> 0.87954907643463798 | G32: =10*LOG10((G$23^2 - $B32^2)/(G$23*(1-$B32^2)))-G$22 -> 1.0253151296101333 | H32: =10*LOG10((H$23^2 - $B32^2)/(H$23*(1-$B32^2)))-H$22 -> 1.2288614200866823 | I32: =10*LOG10((I$23^2 - $B32^2)/(I$23*(1-$B32^2)))-I$22 -> 1.4148287598675791
A37: Length | B37: 100 | J37: metres
A38: Matched loss | C38: =$B37*$B$2*(C$4/$B$3)^0.51 -> 8.3353757480941287E-2 | D38: =$B37*$B$2*(D$4/$B$3)^0.51 -> 0.11700674746412287 | E38: =$B37*$B$2*(E$4/$B$3)^0.51 -> 0.16662348161246138 | F38: =$B37*$B$2*(F$4/$B$3)^0.51 -> 0.19986474989504235 | G38: =$B37*$B$2*(G$4/$B$3)^0.51 -> 0.23728020158129068 | H38: =$B37*$B$2*(H$4/$B$3)^0.51 -> 0.29178841489050422 | I38: =$B37*$B$2*(I$4/$B$3)^0.51 -> 0.34400058678037998 | J38: dB
A39: a = 10^(ML/10) | C39: =10^(C38/10) -> 1.0193782798942115 | D39: =10^(D38/10) -> 1.0273080109258597 | E39: =10^(E38/10) -> 1.0391119711388588 | F39: =10^(F38/10) -> 1.0470959383709044 | G39: =10^(G38/10) -> 1.0561558773340065 | H39: =10^(H38/10) -> 1.0694952042692252 | I39: =10^(I38/10) -> 1.0824305938575907
A40: SWR | B40: |rho|
A41: 1 | B41: =(A41-1)/(A41+1) -> 0.000 | C41: =10*LOG10((C$39^2 - $B41^2)/(C$39*(1-$B41^2)))-C$38 -> 4.0245584642661925E-16 | D41: =10*LOG10((D$39^2 - $B41^2)/(D$39*(1-$B41^2)))-D$38 -> 1.5265566588595902E-16 | E41: =10*LOG10((E$39^2 - $B41^2)/(E$39*(1-$B41^2)))-E$38 -> -2.2204460492503131E-16 | F41: =10*LOG10((F$39^2 - $B41^2)/(F$39*(1-$B41^2)))-F$38 -> 0.000 | G41: =10*LOG10((G$39^2 - $B41^2)/(G$39*(1-$B41^2)))-G$38 -> -2.7755575615628914E-16 | H41: =10*LOG10((H$39^2 - $B41^2)/(H$39*(1-$B41^2)))-H$38 -> 0.000 | I41: =10*LOG10((I$39^2 - $B41^2)/(I$39*(1-$B41^2)))-I$38 -> 0.000
A42: 1.5 | B42: =(A42-1)/(A42+1) -> 00.2 | C42: =10*LOG10((C$39^2 - $B42^2)/(C$39*(1-$B42^2)))-C$38 -> 6.809178510648134E-3 | D42: =10*LOG10((D$39^2 - $B42^2)/(D$39*(1-$B42^2)))-D$38 -> 9.4821611130212202E-3 | E42: =10*LOG10((E$39^2 - $B42^2)/(E$39*(1-$B42^2)))-E$38 -> 1.3345403531375366E-2 | F42: =10*LOG10((F$39^2 - $B42^2)/(F$39*(1-$B42^2)))-F$38 -> 1.5882811736034841E-2 | G42: =10*LOG10((G$39^2 - $B42^2)/(G$39*(1-$B42^2)))-G$38 -> 1.8691036880514017E-2 | H42: =10*LOG10((H$39^2 - $B42^2)/(H$39*(1-$B42^2)))-H$38 -> 2.2693395541707961E-2 | I42: =10*LOG10((I$39^2 - $B42^2)/(I$39*(1-$B42^2)))-I$38 -> 2.6430763460422446E-2
A43: 2 | B43: =(A43-1)/(A43+1) -> 0.33333333333333331 | C43: =10*LOG10((C$39^2 - $B43^2)/(C$39*(1-$B43^2)))-C$38 -> 2.0395591235688085E-2 | D43: =10*LOG10((D$39^2 - $B43^2)/(D$39*(1-$B43^2)))-D$38 -> 2.8384599857311316E-2 | E43: =10*LOG10((E$39^2 - $B43^2)/(E$39*(1-$B43^2)))-E$38 -> 3.9913810134780819E-2 | F43: =10*LOG10((F$39^2 - $B43^2)/(F$39*(1-$B43^2)))-F$38 -> 4.7475232621234598E-2 | G43: =10*LOG10((G$39^2 - $B43^2)/(G$39*(1-$B43^2)))-G$38 -> 5.5833502205536262E-2 | H43: =10*LOG10((H$39^2 - $B43^2)/(H$39*(1-$B43^2)))-H$38 -> 6.772751248457376E-2 | I43: =10*LOG10((I$39^2 - $B43^2)/(I$39*(1-$B43^2)))-I$38 -> 7.8814565075310428E-2
A44: 5 | B44: =(A44-1)/(A44+1) -> 0.66666666666666663 | C44: =10*LOG10((C$39^2 - $B44^2)/(C$39*(1-$B44^2)))-C$38 -> 0.12890660758061284 | D44: =10*LOG10((D$39^2 - $B44^2)/(D$39*(1-$B44^2)))-D$38 -> 0.17853582759582703 | E44: =10*LOG10((E$39^2 - $B44^2)/(E$39*(1-$B44^2)))-E$38 -> 0.24932983399786735 | F44: =10*LOG10((F$39^2 - $B44^2)/(F$39*(1-$B44^2)))-F$38 -> 0.29524143102543188 | G44: =10*LOG10((G$39^2 - $B44^2)/(G$39*(1-$B44^2)))-G$38 -> 0.34552442557961305 | H44: =10*LOG10((H$39^2 - $B44^2)/(H$39*(1-$B44^2)))-H$38 -> 0.41625265987856419 | I44: =10*LOG10((I$39^2 - $B44^2)/(I$39*(1-$B44^2)))-I$38 -> 0.48133153391029188
A45: 10 | B45: =(A45-1)/(A45+1) -> 0.81818181818181823 | C45: =10*LOG10((C$39^2 - $B45^2)/(C$39*(1-$B45^2)))-C$38 -> 0.31916518088534085 | D45: =10*LOG10((D$39^2 - $B45^2)/(D$39*(1-$B45^2)))-D$38 -> 0.43844116504556274 | E45: =10*LOG10((E$39^2 - $B45^2)/(E$39*(1-$B45^2)))-E$38 -> 0.6053628237928077 | F45: =10*LOG10((F$39^2 - $B45^2)/(F$39*(1-$B45^2)))-F$38 -> 0.71168522543046242 | G45: =10*LOG10((G$39^2 - $B45^2)/(G$39*(1-$B45^2)))-G$38 -> 0.82646796685696389 | H45: =10*LOG10((H$39^2 - $B45^2)/(H$39*(1-$B45^2)))-H$38 -> 0.98511007157306085 | I45: =10*LOG10((I$39^2 - $B45^2)/(I$39*(1-$B45^2)))-I$38 -> 1.1283180655079807
A46: 20 | B46: =(A46-1)/(A46+1) -> 0.90476190476190477 | C46: =10*LOG10((C$39^2 - $B46^2)/(C$39*(1-$B46^2)))-C$38 -> 0.68161229982753924 | D46: =10*LOG10((D$39^2 - $B46^2)/(D$39*(1-$B46^2)))-D$38 -> 0.92269607468696091 | E46: =10*LOG10((E$39^2 - $B46^2)/(E$39*(1-$B46^2)))-E$38 -> 1.2492987472573676 | F46: =10*LOG10((F$39^2 - $B46^2)/(F$39*(1-$B46^2)))-F$38 -> 1.45132593646998 | G46: =10*LOG10((G$39^2 - $B46^2)/(G$39*(1-$B46^2)))-G$38 -> 1.6646053199013506 | H46: =10*LOG10((H$39^2 - $B46^2)/(H$39*(1-$B46^2)))-H$38 -> 1.9517602719025664 | I46: =10*LOG10((I$39^2 - $B46^2)/(I$39*(1-$B46^2)))-I$38 -> 2.2039932219049412
A47: 50 | B47: =(A47-1)/(A47+1) -> 0.96078431372549022 | C47: =10*LOG10((C$39^2 - $B47^2)/(C$39*(1-$B47^2)))-C$38 -> 1.6199335319743395 | D47: =10*LOG10((D$39^2 - $B47^2)/(D$39*(1-$B47^2)))-D$38 -> 2.1212193377624686 | E47: =10*LOG10((E$39^2 - $B47^2)/(E$39*(1-$B47^2)))-E$38 -> 2.7570827189617537 | F47: =10*LOG10((F$39^2 - $B47^2)/(F$39*(1-$B47^2)))-F$38 -> 3.1294450634454645 | G47: =10*LOG10((G$39^2 - $B47^2)/(G$39*(1-$B47^2)))-G$38 -> 3.5076623926624726 | H47: =10*LOG10((H$39^2 - $B47^2)/(H$39*(1-$B47^2)))-H$38 -> 3.9958156035254615 | I47: =10*LOG10((I$39^2 - $B47^2)/(I$39*(1-$B47^2)))-I$38 -> 4.4072312079391249
A48: 100 | B48: =(A48-1)/(A48+1) -> 0.98019801980198018 | C48: =10*LOG10((C$39^2 - $B48^2)/(C$39*(1-$B48^2)))-C$38 -> 2.8391729997262796 | D48: =10*LOG10((D$39^2 - $B48^2)/(D$39*(1-$B48^2)))-D$38 -> 3.5895128776832586 | E48: =10*LOG10((E$39^2 - $B48^2)/(E$39*(1-$B48^2)))-E$38 -> 4.486792056382928 | F48: =10*LOG10((F$39^2 - $B48^2)/(F$39*(1-$B48^2)))-F$38 -> 4.9893913787400139 | G48: =10*LOG10((G$39^2 - $B48^2)/(G$39*(1-$B48^2)))-G$38 -> 5.485526785346309 | H48: =10*LOG10((H$39^2 - $B48^2)/(H$39*(1-$B48^2)))-H$38 -> 6.1075170451029637 | I48: =10*LOG10((I$39^2 - $B48^2)/(I$39*(1-$B48^2)))-I$38 -> 6.6179297283907896